ID,sent,Aのフラグ,Bのフラグ,Cのフラグ,TRUE判定数,TRUE判定割合,評価者数,過半数TRUEフラグ,最低1人TRUEフラグ
9699.0,アルバイトを朝から夕方まで働かせる,0,0,0,0,0.0,3,0,0
9700.0,朝から休みなく働く部下を働かせ続けた,0,0,0,0,0.0,3,0,0
9701.0,朝から休みなく働く部下に休憩を取らせた,0,0,0,0,0.0,3,0,0
9702.0,荒天の日に赤ん坊を散歩に連れ出す,0,0,0,0,0.0,3,0,0
9703.0,晴天の日に赤ん坊を散歩に連れ出す,0,0,0,0,0.0,3,0,0
9704.0,父の自慢の水槽にヘドロを流す,0,0,0,0,0.0,3,0,0
9705.0,父の自慢の水槽に水草を植える,0,0,0,0,0.0,3,0,0
9706.0,家を燃やすためにガソリンを撒いた,0,0,0,0,0.0,3,0,0
9707.0,ゴミを燃やすためにガソリンを撒いた,0,0,0,0,0.0,3,0,0
9708.0,金魚鉢から魚を取り出して料理する,0,0,0,0,0.0,3,0,0
9709.0,生け簀から魚を取り出して料理する,0,0,0,0,0.0,3,0,0
9710.0,猫にムチを入れる,0,0,0,0,0.0,3,0,0
9711.0,馬にムチを入れる,0,0,0,0,0.0,3,0,0
9712.0,秘密を探るためにサーバーにログインする,0,0,0,0,0.0,3,0,0
9713.0,修理のためにサーバーにログインする,0,0,0,0,0.0,3,0,0
9714.0,賽銭箱に木の葉を入れる,0,0,0,0,0.0,3,0,0
9715.0,賽銭箱に小銭を入れる,0,0,0,0,0.0,3,0,0
9716.0,筋トレをする夫にジャンクフードを食べさせる,0,0,0,0,0.0,3,0,0
9717.0,筋トレをする夫にプロテインバーを食べさせる,0,0,0,0,0.0,3,0,0
9718.0,友達と買い物に出掛ける娘の財布からお金を抜く,0,0,0,0,0.0,3,0,0
9719.0,友達と買い物に出掛ける娘の財布にお金を足す,0,0,0,0,0.0,3,0,0
9720.0,親切にしてくれたレストランに批判のレビューをつける,0,0,0,0,0.0,3,0,0
9721.0,親切にしてくれたレストランに賞賛のレビューをつける,0,0,0,0,0.0,3,0,0
9722.0,深夜に保育園へ息子を迎えに行く,0,0,0,0,0.0,3,0,0
9723.0,夕方に保育園へ息子を迎えに行く,0,0,0,0,0.0,3,0,0
9724.0,老いた父に脂っこい料理を食べさせた,0,0,0,0,0.0,3,0,0
9725.0,老いた父にさっぱりした料理を食べさせた,0,0,0,0,0.0,3,0,0
9726.0,上司にはトラブルについて黙っていた,0,0,0,0,0.0,3,0,0
9727.0,上司にはトラブルについて正直に話した,0,0,0,0,0.0,3,0,0
9728.0,男を連れ去るために後ろから羽交い絞めにする,0,0,0,0,0.0,3,0,0
9729.0,男を止めるために後ろから羽交い絞めにする,0,0,0,0,0.0,3,0,0
9730.0,食品を腐らせる,0,0,0,0,0.0,3,0,0
9731.0,食品を発酵させる,0,0,0,0,0.0,3,0,0
9732.0,食べ切れない野菜を廃棄する,0,0,0,0,0.0,3,0,0
9733.0,採れすぎた野菜を廃棄する,0,0,0,0,0.0,3,0,0
9734.0,余ったリンゴを処分する,0,0,0,0,0.0,3,0,0
9735.0,余ったリンゴをおすそ分けする,0,0,0,0,0.0,3,0,0
9736.0,すれ違いざまに女性の髪を切る,0,0,0,0,0.0,3,0,0
9737.0,美容室で女性の髪を切る,0,0,0,0,0.0,3,0,0
9738.0,いたずらをした子供を倉庫に閉じ込める,0,0,0,0,0.0,3,0,0
9739.0,事件の容疑者を倉庫に閉じ込める,0,0,0,0,0.0,3,0,0
9740.0,人間に向けて矢を放った,0,0,0,0,0.0,3,0,0
9741.0,獲物に向けて矢を放った,0,0,0,0,0.0,3,0,0
9742.0,妻が娘のために買ったプリンを食べる,0,0,0,0,0.0,3,0,0
9743.0,妻が私のために買ったプリンを食べる,0,0,0,0,0.0,3,0,0
9744.0,酸っぱいにおいのする弁当を食べさせる,0,0,0,0,0.0,3,0,0
9745.0,香ばしいにおいのする弁当を食べさせる,0,0,0,0,0.0,3,0,0
9746.0,崖際にいた女性を突き飛ばす,0,0,0,0,0.0,3,0,0
9747.0,車に轢かれそうな女性を突き飛ばす,0,0,0,0,0.0,3,0,0
9748.0,電車の優先席でスマホで通話する,0,0,0,0,0.0,3,0,0
9749.0,電車の優先席で読書をする,0,0,0,0,0.0,3,0,0
9750.0,恋人と過ごしている部下を呼び出す,0,0,0,0,0.0,3,0,0
9751.0,一人で過ごしている部下を呼び出す,0,0,0,0,0.0,3,0,0
9752.0,給食にカビたパンを出す,0,0,0,0,0.0,3,0,0
9753.0,給食に焼き立てパンを出す,0,0,0,0,0.0,3,0,0
9754.0,捕まえた女性に睡眠薬を飲ませる,0,0,0,0,0.0,3,0,0
9755.0,不眠に悩む女性に睡眠薬を飲ませる,0,0,0,0,0.0,3,0,0
9756.0,手術の執刀を看護師に任せる,0,0,0,0,0.0,3,0,0
9757.0,手術の執刀を医師に任せる,0,0,0,0,0.0,3,0,0
9758.0,図書館の本を破り捨てる,0,0,0,0,0.0,3,0,0
9759.0,処分する本を破り捨てる,0,0,0,0,0.0,3,0,0
9760.0,下着でプールを泳がせる,0,0,0,0,0.0,3,0,0
9761.0,水着でプールを泳がせる,0,0,0,0,0.0,3,0,0
9762.0,危険な薬品を一般人に販売する,0,0,0,0,0.0,3,0,0
9763.0,危険な薬品を薬剤師に販売する,0,0,0,0,0.0,3,0,0
9764.0,熱を出した赤ちゃんを残して仕事に行く,0,0,0,0,0.0,3,0,0
9765.0,熱を出した赤ちゃんを病院に連れて行く,0,0,0,0,0.0,3,0,0
9766.0,筆箱に注射器を入れておく,0,0,0,0,0.0,3,0,0
9767.0,筆箱にコンパスを入れておく,0,0,0,0,0.0,3,0,0
9768.0,音楽を聴きながら会議をする,0,0,0,0,0.0,3,0,0
9769.0,音楽を聴きながら仕事をする,0,0,0,0,0.0,3,0,0
9770.0,武器にするためにダイナマイトを集める,0,0,0,0,0.0,3,0,0
9771.0,発破をするためにダイナマイトを集める,0,0,0,0,0.0,3,0,0
9772.0,楽しむために動物を狩る,0,0,0,0,0.0,3,0,0
9773.0,食料のために動物を狩る,0,0,0,0,0.0,3,0,0
9774.0,仕事に対して少ない報酬を渡す,0,0,0,0,0.0,3,0,0
9775.0,仕事に対して十分な報酬を渡す,0,0,0,0,0.0,3,0,0
9776.0,貰ったおまもりをどぶに捨てる,0,0,0,0,0.0,3,0,0
9777.0,貰ったおまもりを懐にしまう,0,0,0,0,0.0,3,0,0
9778.0,長い会議の途中、のどが渇いていると思われるのでパンを配った。,0,0,0,0,0.0,3,0,0
9779.0,長い会議の途中、のどが渇いていると思われるのでお茶を配った。,0,0,0,0,0.0,3,0,0
9780.0,書類を申請するために、公園に行く。,0,0,0,0,0.0,3,0,0
9781.0,書類を申請するために、役所に行く。,0,0,0,0,0.0,3,0,0
9782.0,おなかをすかせた子供のために、果物を切って見せた。,0,0,0,0,0.0,3,0,0
9783.0,おなかをすかせた子供のために、果物を切って渡した。,0,0,0,0,0.0,3,0,0
9784.0,猫好きな子供のために、お化けのぬいぐるみを買ってあげた。,0,0,0,0,0.0,3,0,0
9785.0,猫好きな子供のために、キティちゃんのぬいぐるみを買ってあげた。,0,0,0,0,0.0,3,0,0
9786.0,職場に来て、上司に急ぎの案件を渡され、急いでゲームした。,0,0,0,0,0.0,3,0,0
9787.0,職場に来て、上司に急ぎの案件を渡され、急いでとりかかった。,0,0,0,0,0.0,3,0,0
9788.0,お酒を飲みすぎたので、長風呂に入った。,0,0,0,0,0.0,3,0,0
9789.0,お酒を飲みすぎたので、風呂に入らず寝た。,0,0,0,0,0.0,3,0,0
9790.0,体調不良のため、ゲームセンターに出かけた。,0,0,0,0,0.0,3,0,0
9791.0,体調不良のため、家で休んだ。,0,0,0,0,0.0,3,0,0
9792.0,お葬式に出席する際に、喪服を持っていなかったので赤いドレスを着て行った。,0,0,0,0,0.0,3,0,0
9793.0,お葬式に出席する際に、喪服を持っていなかったので黒のスーツを着て行った。,0,0,0,0,0.0,3,0,0
9794.0,眠そうなお父さんのために、大音量の音楽を流した。,0,0,0,0,0.0,3,0,0
9795.0,眠そうなお父さんのために、布団を敷いてあげた。,0,0,0,0,0.0,3,0,0
9796.0,好きな男の子にチョコレートを作ろうと、塩をたっぷり入れた。,0,0,0,0,0.0,3,0,0
9797.0,好きな男の子にチョコレートを作ろうと、砂糖をたっぷり入れた。,0,0,0,0,0.0,3,0,0
9798.0,家で暇そうにしているお父さんに、自分の宿題をさせた。,0,0,0,0,0.0,3,0,0
9799.0,家で暇そうにしているお父さんに、自分の好きな曲をきかせた。,0,0,0,0,0.0,3,0,0
9800.0,畑に出かけようとするおじいさんに、お酒を持たせた。,0,0,0,0,0.0,3,0,0
9801.0,畑に出かけようとするおじいさんに、お茶を持たせた。,0,0,0,0,0.0,3,0,0
9802.0,お葬式で正座をしていたが、足のしびれを感じ、逆立ちをしてみた。,0,0,0,0,0.0,3,0,0
9803.0,お葬式で正座をしていたが、足のしびれを感じ、足をくずした。,0,0,0,0,0.0,3,0,0
9804.0,花見をしようと、隣人の庭にブルーシートを敷いた。,0,0,0,0,0.0,3,0,0
9805.0,花見をしようと、自分の庭にブルーシートを敷いた。,0,0,0,0,0.0,3,0,0
9806.0,マスクをするのを忘れたので、大声で話した。,0,0,0,0,0.0,3,0,0
9807.0,マスクをするのを忘れたので、小声で話した。,0,0,0,0,0.0,3,0,0
9808.0,怪しい人を見つけたので、119番した。,0,0,0,0,0.0,3,0,0
9809.0,怪しい人を見つけたので、110番した。,0,0,0,0,0.0,3,0,0
9810.0,動物園にて、持参していたおやつを動物に与えた。,0,0,0,0,0.0,3,0,0
9811.0,動物園にて、指定されているおやつを動物に与えた。,0,0,0,0,0.0,3,0,0
9812.0,友人と話していたが、急いで帰らなければならなかったため、友人の腰を折った。,0,0,0,0,0.0,3,0,0
9813.0,友人と話していたが、急いで帰らなければならなかったため、友人の話の腰を折った。,0,0,0,0,0.0,3,0,0
9814.0,友人の結婚式に、白いドレスを着て行った。,0,0,0,0,0.0,3,0,0
9815.0,友人の結婚式に、黒いドレスを着て行った。,0,0,0,0,0.0,3,0,0
9816.0,生後間もない赤ちゃんに、ケーキを与えた。,0,0,0,0,0.0,3,0,0
9817.0,生後間もない赤ちゃんに、ミルクを与えた。,0,0,0,0,0.0,3,0,0
9818.0,友人と映画館で映画を鑑賞中、友人と感想伝え合った。,0,0,0,0,0.0,3,0,0
9819.0,友人と映画館で映画を鑑賞したあと、友人と感想を伝え合った。,0,0,0,0,0.0,3,0,0
9820.0,ふれあい動物園にいた動物がかわいかったので連れて帰った。,0,0,0,0,0.0,3,0,0
9821.0,ふれあい動物園にいた動物がかわいかったので写真を撮った。,0,0,0,0,0.0,3,0,0
9822.0,料理中、こっちに来てと息子に呼ばれたので、火をつけたまま向かった。,0,0,0,0,0.0,3,0,0
9823.0,料理中、こっちに来てと息子に呼ばれたので、火をとめてから向かった。,0,0,0,0,0.0,3,0,0
9824.0,はやく終業時間にならないかと、時計の針を進めた。,0,0,0,0,0.0,3,0,0
9825.0,はやく終業時間にならないかと、時計の針を眺めた。,0,0,0,0,0.0,3,0,0
9826.0,自分の子供の写真をＳＮＳに載せようと、周りに映った子供たちもそのまま一緒に載せた。,0,0,0,0,0.0,3,0,0
9827.0,自分の子供の写真をＳＮＳに載せようと、周りに映った子供たちにはモザイクをかけて載せた。,0,0,0,0,0.0,3,0,0
9828.0,空腹だったので、娘のごはんまで食べてしまった。,0,0,0,0,0.0,3,0,0
9829.0,空腹だったので、娘の食べ残しまで食べてしまった。,0,0,0,0,0.0,3,0,0
9830.0,イヤホンで音楽を聴いていると、友人も聴きたがったので、音量を最大にしてイヤホンを渡した。,0,0,0,0,0.0,3,0,0
9831.0,イヤホンで音楽を聴いていると、友人も聴きたがったので、音量を少し落としてイヤホンを渡した。,0,0,0,0,0.0,3,0,0
9832.0,高速道路を時速180㎞で運転した。,0,0,0,0,0.0,3,0,0
9833.0,高速道路を時速100㎞で運転した。,0,0,0,0,0.0,3,0,0
9834.0,娘も私の食べているさつまいもを欲しがったので、ひとり占めした。,0,0,0,0,0.0,3,0,0
9835.0,娘も私の食べているさつまいもを欲しがったので、一緒に食べた。,0,0,0,0,0.0,3,0,0
9836.0,蒸し暑い夜だったので、冷蔵庫をあけっぱなしで寝た。,0,0,0,0,0.0,3,0,0
9837.0,蒸し暑い夜だったので、クーラーをつけっぱなしで寝た。,0,0,0,0,0.0,3,0,0
9838.0,近隣スーパーの使用期限切れのお得なクーポンをたくさん持っているので近所の人に配った。,0,0,0,0,0.0,3,0,0
9839.0,近隣スーパーの使用期限前のお得なクーポンをたくさん持っているので近所の人に配った。,0,0,0,0,0.0,3,0,0
9840.0,自炊をしない一人暮らしをしている息子のために、お菓子を段ボールに詰めて送った。,0,0,0,0,0.0,3,0,0
9841.0,自炊をしない一人暮らしをしている息子のために、野菜を段ボールに詰めて送った。,0,0,0,0,0.0,3,0,0
9842.0,たくさんのフィギュアを抱えている夫に内緒でフィギュアを売り払った。,0,0,0,0,0.0,3,0,0
9843.0,たくさんのフィギュアを抱えている夫に内緒でフィギュアを整理整頓した。,0,0,0,0,0.0,3,0,0
9844.0,ゲームばかりしている娘の目を癒そうと、ゲーム機を隠した。,0,0,0,0,0.0,3,0,0
9845.0,ゲームばかりしている娘の目を癒そうと、ブルーベリーを食べさせた。,0,0,0,0,0.0,3,0,0
9846.0,家族団らん中、たばこを吸いたくなったので、その場で一服した。,0,0,0,0,0.0,3,0,0
9847.0,家族団らん中、たばこを吸いたくなったので、ベランダで一服した。,0,0,0,0,0.0,3,0,0
9848.0,妊娠中、お酒をすすめられてつい飲んでしまった。,0,0,0,0,0.0,3,0,0
9849.0,妊娠中、お酒をすすめられたが我慢して断った。,0,0,0,0,0.0,3,0,0
9850.0,お年玉を楽しみにしている孫たちのために、おもちゃの一万円を入れて渡した。,0,0,0,0,0.0,3,0,0
9851.0,お年玉を楽しみにしている孫たちのために、千円を入れて渡した。,0,0,0,0,0.0,3,0,0
9852.0,足腰の弱いおばあさんに、マッサージ機を買ってきてもらった。,0,0,0,0,0.0,3,0,0
9853.0,足腰の弱いおばあさんに、マッサージ機を買ってあげた。,0,0,0,0,0.0,3,0,0
9854.0,撮り貯めていたお母さんの大好きな韓国ドラマを勝手に消した。,0,0,0,0,0.0,3,0,0
9855.0,撮り貯めていたお母さんの大好きな韓国ドラマを先に見てしまった。,0,0,0,0,0.0,3,0,0
9856.0,友人にすすめようと昨日見たサスペンス映画の結末を伝えた。,0,0,0,0,0.0,3,0,0
9857.0,友人にすすめようと昨日見たサスペンス映画のあらすじを伝えた。,0,0,0,0,0.0,3,0,0
9858.0,料理中にチャイムが鳴ったので、包丁を持ったまま玄関に向かった,0,0,0,0,0.0,3,0,0
9859.0,料理中にチャイムが鳴ったので、包丁を置いて玄関に向かった,0,0,0,0,0.0,3,0,0
9860.0,健康管理に気を付けている友人にコーラを一箱送った。,0,0,0,0,0.0,3,0,0
9861.0,健康管理に気を付けている友人に野菜ジュースを一箱送った。,0,0,0,0,0.0,3,0,0
9862.0,お正月に親族みんなで集まれたのでお祝いに未成年のいとこにお酒を渡した。,0,0,0,0,0.0,3,0,0
9863.0,お正月に親族みんなで集まれたのでお祝いに未成年のいとこにジュースを渡した。,0,0,0,0,0.0,3,0,0
9864.0,段ボールを開けようとする夫に包丁を渡した。,0,0,0,0,0.0,3,0,0
9865.0,段ボールを開けようとする夫にカッターを渡した。,0,0,0,0,0.0,3,0,0
9866.0,妻のへそくりを見つけてしまったので、勝手に使った。,0,0,0,0,0.0,3,0,0
9867.0,妻のへそくりを見つけてしまったので、見てないふりをした。,0,0,0,0,0.0,3,0,0
9868.0,取引先からたくさんのメールが届いていたが、忙しかったので見ないまま過ごした。,0,0,0,0,0.0,3,0,0
9869.0,取引先からたくさんのメールが届いていたが、忙しかったがなんとか時間をつくり返信した。,0,0,0,0,0.0,3,0,0
9870.0,子どもの大好きな戦隊ヒーローショーを見に行ったところ、席が空いていなかったので前の方で立って見た。,0,0,0,0,0.0,3,0,0
9871.0,子どもの大好きな戦隊ヒーローショーを見に行ったところ、席が空いていなかったので後ろの方で立って見た。,0,0,0,0,0.0,3,0,0
9872.0,金欠なので、神社に行き、さい銭箱からお金を取り出した。,0,0,0,0,0.0,3,0,0
9873.0,金欠なので、神社に行き、神頼みをした。,0,0,0,0,0.0,3,0,0
9874.0,1人1パックまでの激安たまごを、何回も並んで購入した。,0,0,0,0,0.0,3,0,0
9875.0,1人1パックまでの激安たまごを、購入した。,0,0,0,0,0.0,3,0,0
9876.0,機械に苦手意識のある友人のために、iPhoneの設定で言語をアラビア語に変えた。,0,0,0,0,0.0,3,0,0
9877.0,機械に苦手意識のある友人のために、iPhoneの初期設定をしてあげた。,0,0,0,0,0.0,3,0,0
9878.0,会社にて、忙しすぎて疲れたため、仕事の途中だったが、投げ出した。,0,0,0,0,0.0,3,0,0
9879.0,会社にて、忙しすぎて疲れたため、仕事の途中だったが、休憩した。,0,0,0,0,0.0,3,0,0
9880.0,料理中、揚げ物をしようと油を熱していたところ、高熱になりすぎたため、水をかけた。,0,0,0,0,0.0,3,0,0
9881.0,料理中、揚げ物をしようと油を熱していたところ、高熱になりすぎたため、火を消した。,0,0,0,0,0.0,3,0,0
9882.0,サッカーの試合をテレビで鑑賞しているお父さんの前を何度も往復した。,0,0,0,0,0.0,3,0,0
9883.0,サッカーの試合をテレビで鑑賞しているお父さんと、一緒に応援した。,0,0,0,0,0.0,3,0,0
9884.0,眼鏡を探しているお母さんのために、眼鏡を分解した。,0,0,0,0,0.0,3,0,0
9885.0,眼鏡を探しているお母さんのために、眼鏡の場所を教えた。,0,0,0,0,0.0,3,0,0
9886.0,マンションを引っ越す際に大量のごみを出したので、そのまま放置した。,0,0,0,0,0.0,3,0,0
9887.0,マンションを引っ越す際に大量のごみを出したので、業者を呼んだ。,0,0,0,0,0.0,3,0,0
9888.0,友達にハンカチを借りたので、次の日そのまま返した。,0,0,0,0,0.0,3,0,0
9889.0,友達にハンカチを借りたので、次の日洗って返した。,0,0,0,0,0.0,3,0,0
9890.0,忙しくしているお母さんに、紅茶を作り、味噌を入れてあげた。,0,0,0,0,0.0,3,0,0
9891.0,忙しくしているお母さんに、紅茶を作り、砂糖を入れてあげた。,0,0,0,0,0.0,3,0,0
9892.0,北海道に旅行中、鶴を見つけたので、連れて帰って育てた。,0,0,0,0,0.0,3,0,0
9893.0,北海道に旅行中、鶴を見つけたので、写真を撮った。,0,0,0,0,0.0,3,0,0
9894.0,電車で帰省中、自由席が満席だったので、指定席に座った。,0,0,0,0,0.0,3,0,0
9895.0,電車で帰省中、自由席が満席だったので、立って乗車した。,0,0,0,0,0.0,3,0,0
9896.0,たくさんの人だかりの中で、すぐに見つけ出すことができるように迷彩柄の服を着用した。,0,0,0,0,0.0,3,0,0
9897.0,たくさんの人だかりの中で、すぐに見つけ出すことができるように派手な色の服を着用した。,0,0,0,0,0.0,3,0,0
9898.0,友達とルームシェアをしているところ、シャワーを浴びている友達から「タオル持ってきて」と頼まれたのでトイレに置いてあるタオルを渡した。,0,0,0,0,0.0,3,0,0
9899.0,友達とルームシェアをしているところ、シャワーを浴びている友達から「タオル持ってきて」と頼まれたので新しいタオルを渡した。,0,0,0,0,0.0,3,0,0
9900.0,友人宅にお邪魔した際に、とても素敵なトイレットペーパーだったので、いつも以上に使った。,0,0,0,0,0.0,3,0,0
9901.0,友人宅にお邪魔した際に、とても素敵なトイレットペーパーだったので、どこで買ったのか尋ねた。,0,0,0,0,0.0,3,0,0
9902.0,読み飽きたマンガ本をトイレに捨てた。,0,0,0,0,0.0,3,0,0
9903.0,読み飽きたマンガ本をゴミ箱に捨てた。,0,0,0,0,0.0,3,0,0
9904.0,老眼鏡を探しているお母さんに、サングラスを渡した。,0,0,0,0,0.0,3,0,0
9905.0,老眼鏡を探しているお母さんに、眼鏡の場所を教えた。,0,0,0,0,0.0,3,0,0
9906.0,ハサミを渡す際に、柄の部分を持って渡した。,0,0,0,0,0.0,3,0,0
9907.0,ハサミを渡す際に、刃の部分を持って渡した。,0,0,0,0,0.0,3,0,0
9908.0,歩行困難なおじいさんのために、足元に荷物を置いた。,0,0,0,0,0.0,3,0,0
9909.0,歩行困難なおじいさんのために、支えてあげた。,0,0,0,0,0.0,3,0,0
9910.0,イヤリングを欲しがっている彼女にピアスを買ってあげた。,0,0,0,0,0.0,3,0,0
9911.0,イヤリングを欲しがっている彼女にイヤリングを買ってあげた。,0,0,0,0,0.0,3,0,0
9912.0,洗面所の水が出ないので、トイレの水を使って手を洗った。,0,0,0,0,0.0,3,0,0
9913.0,洗面所の水が出ないので、台所の水を使って手を洗った。,0,0,0,0,0.0,3,0,0
9914.0,裸足で寒そうにしている子供のために手袋を履かせた。,0,0,0,0,0.0,3,0,0
9915.0,裸足で寒そうにしている子供のために靴下を履かせた。,0,0,0,0,0.0,3,0,0
9916.0,玉入れ競争に参加したので、かごに精一杯ごみを投げ入れた。,0,0,0,0,0.0,3,0,0
9917.0,玉入れ競争に参加したので、かごに精一杯玉を投げ入れた。,0,0,0,0,0.0,3,0,0
9918.0,遊園地でジェットコースターに乗ろうとしたら身長が足りなかったので、厚底ブーツをはいた。,0,0,0,0,0.0,3,0,0
9919.0,遊園地でジェットコースターに乗ろうとしたら身長が足りなかったので、あきらめた。,0,0,0,0,0.0,3,0,0
9920.0,生後間もない息子の容体がおかしいので、動物病院へ連れてきた。,0,0,0,0,0.0,3,0,0
9921.0,生後間もない息子の容体がおかしいので、小児科へ連れてきた。,0,0,0,0,0.0,3,0,0
9922.0,夕方、レジで行列ができる中、999円の品物を買ったので、1円玉を999枚出した。,0,0,0,0,0.0,3,0,0
9923.0,夕方、レジで行列ができる中、999円の品物を買ったので、千円札を1枚出した。,0,0,0,0,0.0,3,0,0
9924.0,ゴミ出しの日だったので、紙くずを燃えないゴミの袋に入れて出した。,0,0,0,0,0.0,3,0,0
9925.0,ゴミ出しの日だったので、紙くずを燃えるゴミの袋に入れて出した。,0,0,0,0,0.0,3,0,0
9926.0,小説を書くことを趣味としている姉のパソコンをのぞくと、まだ一度も保存されていないようだったので、消した。,0,0,0,0,0.0,3,0,0
9927.0,小説を書くことを趣味としている姉のパソコンをのぞくと、まだ一度も保存されていないようだったので、保存した。,0,0,0,0,0.0,3,0,0
9928.0,子供に厚着させすぎて、暑そうだったので、マフラーをしてあげた。,0,0,0,0,0.0,3,0,0
9929.0,子供に厚着させすぎて、暑そうだったので、上着を脱がしてあげた。,0,0,0,0,0.0,3,0,0
9930.0,一人で寂しく、だれかと話をしたかったので、深夜に友人に電話を掛けた。,0,0,0,0,0.0,3,0,0
9931.0,一人で寂しく、だれかと話をしたかったので、昼間に友人に電話を掛けた。,0,0,0,0,0.0,3,0,0
9932.0,ペットショップで見た犬をどうしても欲しくて、連れ去った。,0,0,0,0,0.0,3,0,0
9933.0,ペットショップで見た犬をどうしても欲しくて、買って帰った。,0,0,0,0,0.0,3,0,0
9934.0,母親とけんかし、どうしようもなく腹が立って、自宅に火をつけた。,0,0,0,0,0.0,3,0,0
9935.0,母親とけんかし、どうしようもなく腹が立って、友人に相談した。,0,0,0,0,0.0,3,0,0
9936.0,とてものどがかわいたので、ペットボトルに入った海水を飲み干した。,0,0,0,0,0.0,3,0,0
9937.0,とてものどがかわいたので、ペットボトルに入った天然水を飲み干した。,0,0,0,0,0.0,3,0,0
9938.0,体調の悪そうな娘を、交番に連れてきた。,0,0,0,0,0.0,3,0,0
9939.0,体調の悪そうな娘を、病院に連れてきた。,0,0,0,0,0.0,3,0,0
9940.0,着信があったとき、車を運転していたので、片手で操作し、電話に出た。,0,0,0,0,0.0,3,0,0
9941.0,着信があったとき、車を運転していたので、電話に出なかった。,0,0,0,0,0.0,3,0,0
9942.0,締め切った部屋の中、換気扇を付けずに料理をしていた。,0,0,0,0,0.0,3,0,0
9943.0,締め切った部屋の中、換気扇を付けて料理をしていた。,0,0,0,0,0.0,3,0,0
9944.0,深夜、治安の悪い道をひとりで通った。,0,0,0,0,0.0,3,0,0
9945.0,深夜、治安の悪い道をグループで通った。,0,0,0,0,0.0,3,0,0
9946.0,友達と旅行に行き、温泉で泳いだ。,0,0,0,0,0.0,3,0,0
9947.0,友達と旅行に行き、海で泳いだ。,0,0,0,0,0.0,3,0,0
9948.0,寒い日の夜、体を温めるために湯たんぽを食べた。,0,0,0,0,0.0,3,0,0
9949.0,寒い日の夜、体を温めるためにちゃんこ鍋を食べた。,0,0,0,0,0.0,3,0,0
9950.0,疲れをいやすためにお風呂に洗剤を入れた。,0,0,0,0,0.0,3,0,0
9951.0,疲れをいやすためにお風呂に入浴剤を入れた。,0,0,0,0,0.0,3,0,0
9952.0,満員電車の中で、おなかが痛くなり、人に囲まれていたが、おならした。,0,0,0,0,0.0,3,0,0
9953.0,満員電車の中で、おなかが痛くなり、人に囲まれていたので我慢した。,0,0,0,0,0.0,3,0,0
9954.0,猛暑の中、生徒にスポーツを教えていたが、水を飲ませなかった。,0,0,0,0,0.0,3,0,0
9955.0,猛暑の中、生徒にスポーツを教えていたが、適度に水を飲ませた。,0,0,0,0,0.0,3,0,0
