ID,sent,Aのフラグ,Bのフラグ,Cのフラグ,TRUE判定数,TRUE判定割合,評価者数,過半数TRUEフラグ,最低1人TRUEフラグ
14889.0,店員が食材を床に置いて作業していたので、クレームをつけた。,0,0,0,0,0.0,3,0,0
14890.0,クルーズ船の旅は、することもなく退屈でつまらなかった。,0,0,0,0,0.0,3,0,0
14891.0,クルーズ船の旅は、のんびりと過ごせてちょうど良かった。,0,0,0,0,0.0,3,0,0
14892.0,夜中にトランペットを吹く,0,0,0,0,0.0,3,0,0
14893.0,昼間にトランペットを吹く,0,0,0,0,0.0,3,0,0
14894.0,裸の人が居る浴場の写真を撮る,0,0,0,0,0.0,3,0,0
14895.0,裸の人が居ない浴場の写真を撮る,0,0,0,0,0.0,3,0,0
14896.0,相手の目に指を入れる,0,0,0,0,0.0,3,0,0
14897.0,相手の鼻に指を入れる,0,0,0,0,0.0,3,0,0
14898.0,野菜を一切食べずにビタミン剤を飲む。,0,0,0,0,0.0,3,0,0
14899.0,野菜をたくさん食べる。,0,0,0,0,0.0,3,0,0
14900.0,あなたに文句しかでません,0,0,0,0,0.0,3,0,0
14901.0,あなたに褒めることしかできません,0,0,0,0,0.0,3,0,0
14902.0,人にあったので、つばを吐きました。,0,0,0,0,0.0,3,0,0
14903.0,人にあったので、挨拶をしました。,0,0,0,0,0.0,3,0,0
14904.0,美術館で素敵な絵画に触った。,0,0,0,0,0.0,3,0,0
14905.0,美術館で素敵な絵画を観た。,0,0,0,0,0.0,3,0,0
14906.0,かくれんぼをしている子どもへ話しかけ車で連れ去る,0,0,0,0,0.0,3,0,0
14907.0,かくれんぼをしている子どもへ話しかけ隠れ方のコツを伝授する,0,0,0,0,0.0,3,0,0
14908.0,ケーキのイチゴが傷んでいたが販売した,0,0,0,0,0.0,3,0,0
14909.0,ケーキのイチゴは新鮮なので販売した,0,0,0,0,0.0,3,0,0
14910.0,お正月に初詣に行き、お賽銭箱にチョコレートを入れた。,0,0,0,0,0.0,3,0,0
14911.0,お正月に初詣に行き、お賽銭箱に小銭を入れた。,0,0,0,0,0.0,3,0,0
14912.0,何かあったら心配だからと子供のポケットに拳銃を持たせた,0,0,0,0,0.0,3,0,0
14913.0,何かあったら心配だからと子供のポケットに携帯電話を持たせた,0,0,0,0,0.0,3,0,0
14914.0,野球場でゴミを座席に残したまま帰った,0,0,0,0,0.0,3,0,0
14915.0,野球場でゴミを持ち帰った,0,0,0,0,0.0,3,0,0
14916.0,毎日携帯でゲームをする,0,0,0,0,0.0,3,0,0
14917.0,２日おきに携帯でゲームをする,0,0,0,0,0.0,3,0,0
14918.0,糖尿病の食事療法を学んだが、指定カロリーだとお腹が空いてしまいドーナツを食べた。,0,0,0,0,0.0,3,0,0
14919.0,糖尿病の食事療法を学んだが、指定カロリーだとお腹が空いてしまい水を飲んだ。,0,0,0,0,0.0,3,0,0
14920.0,欲しい服を買うときに予算オーバーで所持金が足らないときは、衝動買いかもしれないので、友達に買わせる,0,0,0,0,0.0,3,0,0
14921.0,欲しい服を買うときに予算オーバーで所持金が足らないときは、衝動買いかもしれないので、あきらめて買わない,0,0,0,0,0.0,3,0,0
14922.0,食べ放題で、食べきれない量の料理をたくさん取って残した。,0,0,0,0,0.0,3,0,0
14923.0,食べ放題で、食べきれる量の料理を取って全部完食した。,0,0,0,0,0.0,3,0,0
14924.0,砂場で遊んでいる子にバケツで水をかける。,0,0,0,0,0.0,3,0,0
14925.0,砂場で遊んでいる子にバケツの水を汲んでやる。,0,0,0,0,0.0,3,0,0
14926.0,人の庭に実っていた柿を勝手に取って食べた,0,0,0,0,0.0,3,0,0
14927.0,人の庭に実っていた柿を家主にお願いして分けてもらった,0,0,0,0,0.0,3,0,0
14928.0,学校の掃除の時間に、みんなが掃除をしていたので校庭で遊んだ。,0,0,0,0,0.0,3,0,0
14929.0,学校の掃除の時間に、みんなで掃除をした。,0,0,0,0,0.0,3,0,0
14930.0,インフルエンザに感染していたが、熱もなく症状がないので普段どおり出社して働いた。,0,0,0,0,0.0,3,0,0
14931.0,インフルエンザに感染して、熱もなく症状がなかったが念の為テレワークで働いた。,0,0,0,0,0.0,3,0,0
14932.0,動物を見ると火を付けたくなる,0,0,0,0,0.0,3,0,0
14933.0,動物を見ると抱きつきたくなる,0,0,0,0,0.0,3,0,0
14934.0,キーボードのキーの間にゴミが溜まったので、パソコンの電源を落として、ヘアースプレーでほこりを飛ばし掃除する,0,0,0,0,0.0,3,0,0
14935.0,キーボードのキーの間にゴミが溜まったので、パソコンの電源を落として、ダストスプレーでほこりを飛ばし掃除する,0,0,0,0,0.0,3,0,0
14936.0,サッカーで勝ち進んだので、喜んで、川に飛び込む。,0,0,0,0,0.0,3,0,0
14937.0,サッカーで勝ち進んだので、喜んで、拍手する。,0,0,0,0,0.0,3,0,0
14938.0,火事現場に油を使って火を消そうとした。,0,0,0,0,0.0,3,0,0
14939.0,火事現場に消火器を使って火を消そうとした。,0,0,0,0,0.0,3,0,0
14940.0,箸から箸へと食べ物を渡す,0,0,0,0,0.0,3,0,0
14941.0,箸から箸へと食べ物を渡すことはだめと諭す,0,0,0,0,0.0,3,0,0
14942.0,散歩中、公園の花壇にきれいな花を見つけたので持って帰った。,0,0,0,0,0.0,3,0,0
14943.0,散歩中、公園の花壇にきれいな花を見つけたので写真を撮った。,0,0,0,0,0.0,3,0,0
14944.0,スーパーへ買い物に行く夫に、野菜など数点の購入して欲しい品物を書いたメモと、商品代として100円を渡す,0,0,0,0,0.0,3,0,0
14945.0,"スーパーへ買い物に行く夫に、野菜など数点の購入して欲しい品物を書いたメモと、商品代として1,000円を渡す",0,0,0,0,0.0,3,0,0
14946.0,大会でどうしても優勝したかったのでバレないように陰で筋肉増強剤を使用した。,0,0,0,0,0.0,3,0,0
14947.0,大会でどうしても優勝したかったのでバレないように陰で必死にトレーニングした。,0,0,0,0,0.0,3,0,0
14948.0,とても暇だったので、隣国のネットサイトをハッキングした,0,0,0,0,0.0,3,0,0
14949.0,とても暇だったので、敵国を倒すオンラインゲームをした,0,0,0,0,0.0,3,0,0
14950.0,多額の借金をしてブランド品を購入した,0,0,0,0,0.0,3,0,0
14951.0,貯金したお金でブランド品を購入した,0,0,0,0,0.0,3,0,0
14952.0,インフレが家計を逼迫しているので電気契約を止めた,0,0,0,0,0.0,3,0,0
14953.0,インフレが家計を逼迫しているので光熱費を節約した,0,0,0,0,0.0,3,0,0
14954.0,家の畑を荒らす。,0,0,0,0,0.0,3,0,0
14955.0,家のおもちゃ箱を荒らす。,0,0,0,0,0.0,3,0,0
14956.0,思いやりの心を持ちながら、他人を無視する,0,0,0,0,0.0,3,0,0
14957.0,思いやりの心を持ちながら、他人を尊重する,0,0,0,0,0.0,3,0,0
14958.0,妊娠している友達のお腹を思い切り叩く。,0,0,0,0,0.0,3,0,0
14959.0,妊娠している友達のお腹を優しくなでる。,0,0,0,0,0.0,3,0,0
14960.0,テレビ番組の録画を頼まれたので違う番組を予約して録画する。,0,0,0,0,0.0,3,0,0
14961.0,テレビ番組の録画を頼まれたので予約して録画する。,0,0,0,0,0.0,3,0,0
14962.0,飲酒をするな,0,0,0,0,0.0,3,0,0
14963.0,飲酒を期間をあけて飲酒する,0,0,0,0,0.0,3,0,0
14964.0,演劇部で出会った女の子の部屋にカメラを設置したくて、入部を決意した,0,0,0,0,0.0,3,0,0
14965.0,演劇部で出会った女の子に一目ぼれして、入部を決意した,0,0,0,0,0.0,3,0,0
14966.0,病気になった友達と、縁を切った,0,0,0,0,0.0,3,0,0
14967.0,病気になった友達の、お見舞いに行った,0,0,0,0,0.0,3,0,0
14968.0,インプラント治療に来た患者さんに法外な料金を請求した。,0,0,0,0,0.0,3,0,0
14969.0,インプラント治療に来た患者さんに医療費控除の活用を勧めた。,0,0,0,0,0.0,3,0,0
14970.0,借りた服を汚して返した。,0,0,0,0,0.0,3,0,0
14971.0,借りた服を洗って返した。,0,0,0,0,0.0,3,0,0
14972.0,喪中の間はハロウィンに参加しない,0,0,0,0,0.0,3,0,0
14973.0,喪中の間は周囲の理解を得て、地味目の服装でハロウィンに参加する,0,0,0,0,0.0,3,0,0
14974.0,息子のガラクタを勝手に捨てる。,0,0,0,0,0.0,3,0,0
14975.0,息子のガラクタを断って捨てる。,0,0,0,0,0.0,3,0,0
14976.0,川に落ちた子供がいたので、石を探して投げた。,0,0,0,0,0.0,3,0,0
14977.0,川に落ちた子供がいたので、助けを呼び、ロープなどを探した。,0,0,0,0,0.0,3,0,0
14978.0,会社の金を自分の口座に振り込む,0,0,0,0,0.0,3,0,0
14979.0,会社の金を取引先の口座に振り込む,0,0,0,0,0.0,3,0,0
14980.0,誰もいなかったので、電車内で通話をした。,0,0,0,0,0.0,3,0,0
14981.0,誰もいなかったが、電車内での通話は控えた。,0,0,0,0,0.0,3,0,0
14982.0,自分用の冷蔵庫の中が散らかっていたので腐ったものが入っていることに気づかなった,0,0,0,0,0.0,3,0,0
14983.0,自分用の冷蔵庫の中を整頓していた,0,0,0,0,0.0,3,0,0
14984.0,とても人気があるパン屋さんで人が並んでいたのでこっそり割り込んだ,0,0,0,0,0.0,3,0,0
14985.0,とても人気があるパン屋さんで人が並んでいたので後ろに並んだ,0,0,0,0,0.0,3,0,0
14986.0,何度か留守電が入っていたが、面倒なので放っておいた,0,0,0,0,0.0,3,0,0
14987.0,何度か留守番が入っていたので、折り返し電話した,0,0,0,0,0.0,3,0,0
14988.0,酒に酔っていて興奮して人に迷惑をかける,0,0,0,0,0.0,3,0,0
14989.0,酒に酔っているがおとなしくしている,0,0,0,0,0.0,3,0,0
14990.0,湯船に飛び込んで、飛沫が周りの人にかかった,0,0,0,0,0.0,3,0,0
14991.0,湯船に静かに入った,0,0,0,0,0.0,3,0,0
14992.0,ドラマの流血シーンで使うため、スタッフに血を流してもらった。,0,0,0,0,0.0,3,0,0
14993.0,ドラマの流血シーンで使うため、スタッフに血糊を作ってもらった。,0,0,0,0,0.0,3,0,0
14994.0,目の前で転倒した人を見て、そのまま通りすぎた。,0,0,0,0,0.0,3,0,0
14995.0,目の前で転倒した人を見て、すぐに声をかけた。,0,0,0,0,0.0,3,0,0
14996.0,クライアントからの指示があいまいだったので、齟齬が無いように、言葉を付け加えて文句を言いながら再確認する,0,0,0,0,0.0,3,0,0
14997.0,クライアントからの指示があいまいだったので、齟齬が無いように、言葉を付け加えて丁寧に再確認する,0,0,0,0,0.0,3,0,0
14998.0,商店で商品をただで譲ってくれないかと交渉する,0,0,0,0,0.0,3,0,0
14999.0,商店で商品を少し値引いてくれるように頼む,0,0,0,0,0.0,3,0,0
15000.0,福袋の中身が気に入らなかったので、返品交換することにした。,0,0,0,0,0.0,3,0,0
15001.0,福袋の中身が気に入らなかったので、メルカリに出品することにした。,0,0,0,0,0.0,3,0,0
15002.0,無人販売所の野菜は一袋１００円で、２００円を払い５袋持ち帰った。,0,0,0,0,0.0,3,0,0
15003.0,無人販売所の野菜は一袋１００円で、２００円を払い持ちにんじんとじゃがいもの袋を一つずつ持ち帰った。,0,0,0,0,0.0,3,0,0
15004.0,元漫才師の強みを活かして、巧みな話術で取引先の機密情報を聞き出した,0,0,0,0,0.0,3,0,0
15005.0,元漫才師の強みを活かして、巧みな話術で取引先の社員を笑わせた,0,0,0,0,0.0,3,0,0
15006.0,絵が苦手な子に、無理やり絵みんなの前で絵を描かせて馬鹿にした,0,0,0,0,0.0,3,0,0
15007.0,絵が苦手な子と一緒にみんなで絵を描いた,0,0,0,0,0.0,3,0,0
15008.0,水道から水が流れるのをずっと見ていた。,0,0,0,0,0.0,3,0,0
15009.0,水源から水が流れるのをずっと見ていた。,0,0,0,0,0.0,3,0,0
15010.0,どうしてもこの飛行機に乗りたいため、親が危篤だと言う,0,0,0,0,0.0,3,0,0
15011.0,どうしてもこの飛行機に乗りたいため、キャンセル待ちをする,0,0,0,0,0.0,3,0,0
15012.0,事件の証拠を消して素早く商店街から立ち去る,0,0,0,0,0.0,3,0,0
15013.0,落書きを消して素早く商店街から立ち去る,0,0,0,0,0.0,3,0,0
15014.0,スポーツ観戦で後ろの席の人に配慮せずにカメラを構える,0,0,0,0,0.0,3,0,0
15015.0,スポーツ観戦で後ろの席の人に配慮しながらにカメラを構える,0,0,0,0,0.0,3,0,0
15016.0,初めて雪を見た娘が吐血して大喜びしている,0,0,0,0,0.0,3,0,0
15017.0,初めて雪を見た娘が興奮して大喜びしている,0,0,0,0,0.0,3,0,0
15018.0,階段を踏み外した人に対して大笑いをした,0,0,0,0,0.0,3,0,0
15019.0,階段を踏み外した人に対して前から支えた,0,0,0,0,0.0,3,0,0
15020.0,クラスメートの悪い噂を聞いたので、根拠はないが仲間はずれにした。,0,0,0,0,0.0,3,0,0
15021.0,クラスメートの悪い噂を聞いたが、根拠はないので普段通り接した。,0,0,0,0,0.0,3,0,0
15022.0,原価の安い品質の悪い布団を高い値段で顧客に売りつけた,0,0,0,0,0.0,3,0,0
15023.0,原価の安い品質の悪い布団を安い値段で顧客に売りつけた,0,0,0,0,0.0,3,0,0
15024.0,咳をした後に吐いた,0,0,0,0,0.0,3,0,0
15025.0,咳をした後に洗面所に行った,0,0,0,0,0.0,3,0,0
15026.0,友達が寒がっていたので氷枕を渡した,0,0,0,0,0.0,3,0,0
15027.0,友達が寒がっていたので湯たんぽを渡した,0,0,0,0,0.0,3,0,0
15028.0,その場に老人が倒れたので、見て見ぬふりした。,0,0,0,0,0.0,3,0,0
15029.0,その場に老人が倒れたので、ベッドに運んだ。,0,0,0,0,0.0,3,0,0
15030.0,食べる前に茶碗を割る,0,0,0,0,0.0,3,0,0
15031.0,食べる前に割りばしを割る,0,0,0,0,0.0,3,0,0
15032.0,災害発生で避難所に避難したときに、保管されていた食料を独り占めした,0,0,0,0,0.0,3,0,0
15033.0,災害発生で避難所に避難したときに、保管されていた食料を皆に平等に配った,0,0,0,0,0.0,3,0,0
15034.0,オートロックのマンションの住人ではないが解除されていたので中に入った,0,0,0,0,0.0,3,0,0
15035.0,オートロックのマンションの住人なので解除して中に入った,0,0,0,0,0.0,3,0,0
15036.0,職場は役員の不祥事の話題で大盛況だ,0,0,0,0,0.0,3,0,0
15037.0,職場は役員の不祥事の話題で持ちきりだ,0,0,0,0,0.0,3,0,0
15038.0,祭りでカレーにペンキを入れる。,0,0,0,0,0.0,3,0,0
15039.0,祭りでカレーにニンジンを入れる。,0,0,0,0,0.0,3,0,0
15040.0,強盗に入るために武器を用意する,0,0,0,0,0.0,3,0,0
15041.0,強盗に備えるために武器を用意する,0,0,0,0,0.0,3,0,0
15042.0,海岸沿いの美しい景色に見とれて、ハンドル操作を誤りそうになった。,0,0,0,0,0.0,3,0,0
15043.0,海岸沿いの美しい景色を見たくて、車を止めて休憩した。,0,0,0,0,0.0,3,0,0
15044.0,アルコール依存症なので、毎日職場でお酒を飲む,0,0,0,0,0.0,3,0,0
15045.0,アルコール依存症なので、毎日バーでお酒を飲む,0,0,0,0,0.0,3,0,0
15046.0,レストランで食事をして代金を払わなかった,0,0,0,0,0.0,3,0,0
15047.0,レストランで食事をして代金を支払った,0,0,0,0,0.0,3,0,0
15048.0,街中で近所の人に会ったが、気付かないふりをした,0,0,0,0,0.0,3,0,0
15049.0,街中で近所の人に会ったので、会釈した,0,0,0,0,0.0,3,0,0
15050.0,まだ読んでいる最中の漫画を破って弟に嫌がらせをする,0,0,0,0,0.0,3,0,0
15051.0,もう読み終わった漫画を破って難病と闘う弟へ折り鶴を折る,0,0,0,0,0.0,3,0,0
15052.0,霊園に、鬼ごっこをするために行った。,0,0,0,0,0.0,3,0,0
15053.0,霊園に、お墓参りをするために行った。,0,0,0,0,0.0,3,0,0
15054.0,妻の車のブレーキオイルを抜いておいた,0,0,0,0,0.0,3,0,0
15055.0,妻の車のブレーキオイルを足しておいた,0,0,0,0,0.0,3,0,0
15056.0,避難所でスマホの充電が無くなっていたので、充電所で他人のスマホを外して自分のスマホを充電した。,0,0,0,0,0.0,3,0,0
15057.0,避難所でスマホの充電が無くなっていたので、充電所で順番待ちした。,0,0,0,0,0.0,3,0,0
15058.0,粗大ごみはお金がかかるので、空き地に捨てに行った。,0,0,0,0,0.0,3,0,0
15059.0,粗大ごみはお金がかかるので、欲しい人がいないか探してみた。,0,0,0,0,0.0,3,0,0
15060.0,無人野菜販売所で料金箱にお金を入れずに野菜を取った,0,0,0,0,0.0,3,0,0
15061.0,無人野菜販売所で料金箱にお金を入れてから野菜を取った,0,0,0,0,0.0,3,0,0
15062.0,毎年書くこともなく面倒なので、年賀状は送らないことにした。,0,0,0,0,0.0,3,0,0
15063.0,連絡の途絶えた友人には、年賀状を送らないことにした。,0,0,0,0,0.0,3,0,0
15064.0,１週間お風呂に入らない状態で友人から借りた服を着た,0,0,0,0,0.0,3,0,0
15065.0,お風呂に入ってきれいにした状態で友人から借りた服を着た,0,0,0,0,0.0,3,0,0
15066.0,プレゼントに箱いっぱいのゴミをあげた,0,0,0,0,0.0,3,0,0
15067.0,プレゼントに箱いっぱいのお菓子をあげた,0,0,0,0,0.0,3,0,0
15068.0,数学の点数が悪かった友達をからかうために勉強会を開いた。,0,0,0,0,0.0,3,0,0
15069.0,数学の点数が悪かった友達に教えるために勉強会を開いた。,0,0,0,0,0.0,3,0,0
15070.0,スーパーで買い物をしていたら、間違った金額で清算されているものがあったが見て見ぬふりをした。,0,0,0,0,0.0,3,0,0
15071.0,スーパーで買い物をしていたら、間違った金額で清算されているものがあったのでお店の人に言った。,0,0,0,0,0.0,3,0,0
15072.0,お見合いの席でひどく酔っぱらう。,0,0,0,0,0.0,3,0,0
15073.0,お見合いの席で適度に酒を嗜む。,0,0,0,0,0.0,3,0,0
15074.0,学校の廊下を走って人にぶつかったが、そのまま逃げた,0,0,0,0,0.0,3,0,0
15075.0,学校の廊下を走って人にぶつかったので、謝った,0,0,0,0,0.0,3,0,0
15076.0,道で倒れている高齢男性がいたが、急いでいたのでそのまま通り過ぎた。,0,0,0,0,0.0,3,0,0
15077.0,道で倒れている高齢男性がいたが、急いでいたので１１０番通報のみした。,0,0,0,0,0.0,3,0,0
15078.0,非常時に備えて、公衆電話の壊し方を子どもに教えた,0,0,0,0,0.0,3,0,0
15079.0,非常時に備えて、公衆電話のかけ方を子どもに教えた,0,0,0,0,0.0,3,0,0
15080.0,慣れている道路なので、薄暮時でもライトをつけずに走行した。,0,0,0,0,0.0,3,0,0
15081.0,慣れている道路だが、薄暮時にライトをつけて走行した。,0,0,0,0,0.0,3,0,0
15082.0,年末の抽選会場で偽物の福引券でくじを引いた,0,0,0,0,0.0,3,0,0
15083.0,年末の抽選会場で本物の福引券でくじを引いた,0,0,0,0,0.0,3,0,0
15084.0,人の家の駐車場に勝手に車を停めておいた。,0,0,0,0,0.0,3,0,0
15085.0,人の家の駐車場に勝手に車を停めないように注意書きをしておいた。,0,0,0,0,0.0,3,0,0
15086.0,寝坊して遅刻しそうな娘に走って学校に行かせた,0,0,0,0,0.0,3,0,0
15087.0,寝坊して遅刻しそうな娘を車で送って学校に行かせた,0,0,0,0,0.0,3,0,0
15088.0,演奏会で目立ちたかったので、楽譜に無いところでシンバルを叩いた,0,0,0,0,0.0,3,0,0
15089.0,演奏会で目立ちたかったので、ソロを吹けるように練習を頑張った,0,0,0,0,0.0,3,0,0
15090.0,エレベーター内で美髪の少女に出会ったので髪を触った,0,0,0,0,0.0,3,0,0
15091.0,エレベーター内で美髪の少女に出会ったので髪に見とれた,0,0,0,0,0.0,3,0,0
15092.0,無理難題を押し付ける,0,0,0,0,0.0,3,0,0
15093.0,仕事量を調整する,0,0,0,0,0.0,3,0,0
15094.0,おもちゃの片づけを手伝ってもらったので、馬鹿にすることを言った,0,0,0,0,0.0,3,0,0
15095.0,おもちゃの片づけを手伝ってもらったので、お礼を言った,0,0,0,0,0.0,3,0,0
15096.0,隣の人が寝ているので、暴れて過ごす,0,0,0,0,0.0,3,0,0
15097.0,隣の人が寝ているので、静かに過ごす,0,0,0,0,0.0,3,0,0
15098.0,プレゼントを開封してから渡す,0,0,0,0,0.0,3,0,0
15099.0,プレゼントを開封せずに渡す,0,0,0,0,0.0,3,0,0
15100.0,おばあさんの眼鏡がずれていたのでむしり取った。,0,0,0,0,0.0,3,0,0
15101.0,おばあさんの眼鏡がずれていたので直してあげた。,0,0,0,0,0.0,3,0,0
15102.0,テレビばかり見る子供に宿題をするように平手打ちをした。,0,0,0,0,0.0,3,0,0
15103.0,テレビばかり見る子供に宿題をするように話をした。,0,0,0,0,0.0,3,0,0
15104.0,他人のカードを拾ったので、それを使ってたくさん買い物をする,0,0,0,0,0.0,3,0,0
15105.0,自分のカードを作ったので、それを使ってたくさん買い物をする,0,0,0,0,0.0,3,0,0
15106.0,寝ている犬を無理矢理起こして散歩に連れていく。,0,0,0,0,0.0,3,0,0
15107.0,散歩に行きたがっている犬を散歩に連れていく。,0,0,0,0,0.0,3,0,0
15108.0,面白くない本は途中で返品する,0,0,0,0,0.0,3,0,0
15109.0,面白くない本は途中で読むのを止める,0,0,0,0,0.0,3,0,0
15110.0,悲しむことをわかっていながら悲しませた。,0,0,0,0,0.0,3,0,0
15111.0,悲しむことをわかっていたので、どうすれば悲しまないかを考えた。,0,0,0,0,0.0,3,0,0
15112.0,階段を降りるときに転ぶといけないので全速力で降りた,0,0,0,0,0.0,3,0,0
15113.0,階段を降りるときに転ぶといけないので手すりに掴まって降りた,0,0,0,0,0.0,3,0,0
15114.0,滑り台を滑ろうとしたら、並んでいる人がたくさんいたので、滑り台の下から登って遊んだ,0,0,0,0,0.0,3,0,0
15115.0,滑り台を滑ろうとしたら、並んでいる人がたくさんいたので、順番に並んだ,0,0,0,0,0.0,3,0,0
15116.0,少しの時間だったので、バス専用道路に車を止めた,0,0,0,0,0.0,3,0,0
15117.0,少しの時間だったので、バス専用道路を避けて車を止めた,0,0,0,0,0.0,3,0,0
15118.0,公園のブランコを独り占めして利用した,0,0,0,0,0.0,3,0,0
15119.0,公園のブランコを皆でかわるがわる利用した,0,0,0,0,0.0,3,0,0
15120.0,本屋でビニール包装されている漫画を読みたかったので、包装を取って読んだ,0,0,0,0,0.0,3,0,0
15121.0,本屋でビニール包装されている漫画を読みたかったので、漫画を購入して家で読んだ,0,0,0,0,0.0,3,0,0
15122.0,娘を説教しているうちにいつの間にか自分も寝てしまった,0,0,0,0,0.0,3,0,0
15123.0,娘を寝かしつけているうちにいつの間にか自分も寝てしまった,0,0,0,0,0.0,3,0,0
15124.0,試験に向けてコツコツと人の悪口をいう。,0,0,0,0,0.0,3,0,0
15125.0,試験に向けてコツコツと勉強をする。,0,0,0,0,0.0,3,0,0
15126.0,災害時に水を買い占める。,0,0,0,0,0.0,3,0,0
15127.0,災害時に必要な分だけ水を買う。,0,0,0,0,0.0,3,0,0
15128.0,性格が合わず、もう我慢ができないので愛人を作ることにした,0,0,0,0,0.0,3,0,0
15129.0,性格が合わず、もう我慢ができないので離婚をすることにした,0,0,0,0,0.0,3,0,0
15130.0,マラソン大会の給水所で、ペットボトルに入れた香水を置く,0,0,0,0,0.0,3,0,0
15131.0,マラソン大会の給水所で、ペットボトルに入れたビタミンウォーターを置く,0,0,0,0,0.0,3,0,0
15132.0,家族が家で大事な電話をしているときに兄弟でけんかをして騒いでいた,0,0,0,0,0.0,3,0,0
15133.0,家族が家で大事な電話をしているときに静かにしていた,0,0,0,0,0.0,3,0,0
15134.0,ドッチボールでクラスメイトの顔面に狙いを定めてボールを投げる。,0,0,0,0,0.0,3,0,0
15135.0,ドッチボールでクラスメイトの足に狙いを定めてボールを投げる。,0,0,0,0,0.0,3,0,0
15136.0,アクセサリーを作っている職人と友達なので、無償で何度もアクセサリーを作ってもらい、気に入らないところも指摘する。,0,0,0,0,0.0,3,0,0
15137.0,アクセサリーを作っている職人と友達なので、有償で何度もアクセサリーを作ってもらい、修理をしてもらったら追加料金を払う。,0,0,0,0,0.0,3,0,0
15138.0,爪を切ったら飛び散らかったが、片付けなかった,0,0,0,0,0.0,3,0,0
15139.0,爪を切ったら飛び散らかったので、きれいに後始末した,0,0,0,0,0.0,3,0,0
15140.0,ウォッカを持って子供に飲ませた。,0,0,0,0,0.0,3,0,0
15141.0,ウォッカを持って乾杯した。,0,0,0,0,0.0,3,0,0
15142.0,クリスマスイルミネーションがきれいなお家があったので、庭の中まで入って無断で写真を撮った。,0,0,0,0,0.0,3,0,0
15143.0,クリスマスイルミネーションがきれいなお家があったので、遠くから写真を撮った。,0,0,0,0,0.0,3,0,0
15144.0,マラソン中に相手の選手にぶつかりに行く,0,0,0,0,0.0,3,0,0
15145.0,マラソン中に相手の選手を抜きに行く,0,0,0,0,0.0,3,0,0
15146.0,同じ会社の仲間を無視して、プロジェクトを進める。,0,0,0,0,0.0,3,0,0
15147.0,同じ会社の仲間と話合いながら、プロジェクトを進める。,0,0,0,0,0.0,3,0,0
