ID,Original_ID,sent,label,Aのフラグ
585,4973,銭湯に行ったら大浴場に誰も他のお客さんが居なかったので泳いで遊んでいた。,1,FALSE
586,10447,お年玉と一緒に生ごみを渡した。,1,FALSE
587,2086,体育祭の日にヘアゴムを家に忘れてきた,0,FALSE
588,1291,トイレに行きたくなったので、道端で用を足した,1,FALSE
589,12912,泣き止まないのでなだめる,0,FALSE
590,11611,友達のおもちゃで遊びたくなったので、「貸して」と言う,0,FALSE
591,18962,取引先への贈答品を購入し、領収書を処分する。,1,FALSE
592,4886,親に隠れてプレゼントを運ぶ。,0,FALSE
593,12390,穴に柿をさして、ドアを開けた。,1,TRUE
594,9870,子どもの大好きな戦隊ヒーローショーを見に行ったところ、席が空いていなかったので前の方で立って見た。,1,FALSE
595,2113,車がよく通る道路の真ん中で縄跳びをしていた,1,FALSE
596,2266,人を轢く。,1,FALSE
597,9676,祖父の山で山菜取りをする,0,FALSE
598,9991,バリウムが苦手なので、代わりに胃カメラを選んだ。,0,FALSE
599,18718,寄り道せずにまっすぐ帰ってくるよう言われていたが、駄菓子屋に立ちよった,1,FALSE
600,5349,友達から秘密を打ち明けられ、誰にも言わないでと言われたが仲の良い人全員にだけ勝手に話した。,1,FALSE
601,17195,尿意を催し、自宅のトイレに駆け込んだ。,0,FALSE
602,17060,シャツのボタンが取れたので全裸で歩いた。,1,FALSE
603,6416,病状が判断できないので、救急車を呼ぶ,0,TRUE
604,16345,スーパーで買い物をし、財布を忘れた事に気付き、かごに入れた商品を棚に戻し、財布を取りに家に帰る,0,FALSE
605,1748,歯を磨く,0,FALSE
606,15620,人をかみ殺す,1,FALSE
607,16517,迷子で泣いている子供の口に飴玉を入れてあげた,0,FALSE
608,3049,法要の時お坊さんのお経を聴いていると、眠くなってしまい、座ったまま寝てしまった,1,FALSE
609,10232,津波で家を流された友人に、海の近くの小さな家を紹介した,1,FALSE
610,16545,自己申告制の飲み屋で、7杯飲んだのでそのとおり申告した,0,FALSE
611,14250,Web試験を友達に代わりに受けてもらう。,1,FALSE
612,1115,料理中の母親のエプロンのリボンがほどけかかっていたので、リボンをほどいてあげた,1,FALSE
613,5816,空腹で泣いている赤ちゃんのために粉ミルクを哺乳瓶に入れ人肌程度のお湯で溶かした,0,FALSE
614,18376,怪しげな投資話を知人に勧めた,1,FALSE
615,4936,ゆうパックで書類を送るように指示する。,0,FALSE
616,14941,箸から箸へと食べ物を渡すことはだめと諭す,0,FALSE
617,7593,貧困の幼少期から何の努力もせず、ひたすら社会を恨み続けた。,0,FALSE
618,5484,仕事で何度か同じミスを繰り返してしまったので、気を付ける。,0,FALSE
619,19100,妻が妊娠しているときは出漁しない,0,FALSE
620,9062,寒気を感じたので、コンビニのおでんを買って食べた,0,FALSE
621,16096,朝寝坊して遅刻しそうになったので、パジャマのまま家を飛び出した。,0,FALSE
622,3572,お正月にクリスマスツリーを飾る,1,FALSE
623,8410,雨が降ってきたので、洗濯物を部屋に入れた。,0,FALSE
624,12746,彼氏の鼻毛が出ていたのでハサミで切ってあげた,0,FALSE
625,8511,免許証を携帯していないので、そのまま運転した。,1,FALSE
626,10685,落し物があったので放置した,1,FALSE
627,17723,一人カラオケの最中に大声で叫んだ。,0,FALSE
628,9410,彼女とフランス料理を食べに行き、料理をフォークとナイフで食べた。,0,FALSE
629,2134,本を読みながら、スマホを見る。,0,FALSE
630,5171,柔道の審判をしている時は、同じ国の選手を贔屓採点している。,1,FALSE
631,11219,スキーに行きたがっている子供をスキー場に連れて行った,0,FALSE
632,12650,砂浜を掘るとたくさんのアサリが取れた,0,FALSE
633,19229,動物園のカバが大きな口を開けたので、じっくり観察した,0,FALSE
634,13070,野菜を大雑把に切る,0,FALSE
635,4129,余ったキャットフードを祖母に食べさせた,1,FALSE
636,16680,知人の誕生日だったので安いプレゼントを送った,0,FALSE
637,18172,入院中のお婆さんに固い餅を持っていく。,1,FALSE
638,6272,ペットの犬が死んでしまったので、庭に埋葬した。,0,FALSE
639,4742,歩いて帰るのが面倒だったので、他人の自転車を勝手に使った。,1,FALSE
640,12203,良いことをした子供の頭を叩いて褒めた。,1,FALSE
641,14049,詰め替えのシャンプーを使う,0,FALSE
642,9532,空のペットボトルをごみ箱に投げ捨てる,0,FALSE
643,7325,近所で焚火をしていたので、家のゴミを投げ入れた。,1,FALSE
644,425,こねたハンバーグを調理せずテーブルに出す,1,FALSE
645,7317,お土産のお菓子が自分好みではなかったので、ゴミ箱に捨てた。,1,FALSE
646,14948,とても暇だったので、隣国のネットサイトをハッキングした,1,FALSE
647,6691,蜂に刺されたら尿をかける,0,TRUE
648,6665,全ての教会での写真撮影は禁止と言い切る,1,FALSE
649,2625,見栄えを良くしたかったので、隣の家の花壇に花を植える,1,FALSE
650,3377,隣国に戦いを挑む,1,FALSE
651,6286,疲れていたので、電車で空席があり、座ることができた。,0,FALSE
652,6491,お酒を飲んではいけない,0,TRUE
653,5672,カレーに薬味を混ぜる,0,FALSE
654,3911,宝くじが当たったので、沢山のお札をシュレッダーにかけた。,1,FALSE
655,14134,運転中、速度を上げて歩行者のすぐそばを通過する。,1,FALSE
656,7518,クリスマスのイルミネーションを見るために、郊外に出掛けた。,0,FALSE
657,3711,赤ちゃんに餅を食べさせる,1,FALSE
658,15191,何も入っていない靴下を振り回す,0,FALSE
659,14033,マンションの二階で日中に激しい運動をする。,1,FALSE
660,10081,家に帰る方法が分からないと言われたので、警察署の電話番号を書いて渡した,0,FALSE
661,7692,なぜそんな病気になってしまったのだと嘆くが、受け入れる。,0,FALSE
662,8488,レストランの料理がおいしくなかったが、支払いを済ませて帰った。,0,FALSE
663,5457,体力には自信があるので仕事があっても自己管理は特にしない。,0,FALSE
664,6225,夫婦で家事は分担して協力するはずが、女がする事と周りも夫も決めつける。,1,FALSE
665,2617,パソコン作業の邪魔をする猫に、どきなさいと大声を出す,1,FALSE
666,5750,うとうとして横になっていたら、上から落ち葉をかけられた,0,TRUE
667,9438,以前から計画していたので、友達と旅行した。,0,FALSE
668,15499,注文のあった商品を送り、代金を請求した,0,FALSE
669,3166,疲れていたが通勤電車で老人に席を譲った,0,FALSE
670,15233,事故で亡くなった人の花束が飾ってあったので、手を合わせた。,0,FALSE
671,17959,泊っているホテルの部屋が広かったため、写真を撮って友達に自慢した,0,FALSE
672,2947,サンドイッチの具がなかったので、冷凍餃子をそのまま挟んで食べた。,1,TRUE
673,7733,出したゴミがカラスに荒らされていたが見て見ぬふりをした。,0,FALSE
674,6742,介護施設でお世話をしている高齢者の通帳から勝手にお金を引き出した。,1,FALSE
675,2027,業績が厳しいので、仕事を頑張った従業員に給与を与えなかった,1,FALSE
676,4200,お店を予約していたが、都合が悪くなったのでキャンセルを電話で伝えた,0,FALSE
677,2236,友達の折り紙を折る。,0,TRUE
678,813,びっくりさせるためチョークを試験管に落とす,1,FALSE
679,9984,観葉植物の葉が枯れかかっていたので、育毛剤を入れた。,1,FALSE
680,11737,図書館の本を途中まで読んだので、しおりを挟む,0,FALSE
681,7502,幼いころは裕福だったので、正月は家族で海外旅行に出掛けた。,0,FALSE
682,14077,エレベーターでまだ乗ってくる人がいたので、「開く」のボタンを押して待ってあげた。,0,FALSE
683,8026,上司の顔色を上塗りしながら仕事を進める,0,TRUE
684,5955,車で人をはねてしまったが動揺してそのまま逃走する,1,FALSE
685,19204,ご飯を食べる前に泥を触る。,1,FALSE
686,13497,暗いところでいじめられていた子供を見て助けてあげた,0,FALSE
687,4768,鳥の餌に唐辛子を混ぜる。,1,FALSE
688,18709,運転免許を取ったら、車に父を乗せてキャンプに行きたい,0,FALSE
689,5386,宿題が難しいので友達に教えてもらった。,0,FALSE
690,2320,人の後をつける。,1,TRUE
691,739,国を背負って戦うので手段を選ばずに戦うように選手に指示した。,1,FALSE
692,4418,教室でテニスをする,1,FALSE
693,4739,宗教団体に所属し、相手が生活できる程度の寄付を求める。,0,FALSE
694,18967,警備員の居る大きなお屋敷に招待され入る,0,FALSE
695,3422,放火して火災保険をもらう,1,FALSE
696,8668,アイマスクがほしいと言っていたがなかったため、買いに行った。,0,FALSE
697,16843,リラックスして面接に挑むため、一番体に馴染んでいるスーツを来て会場に向かった,0,FALSE
698,4780,大雪が降った日に、ノーマルタイヤの車を運転して雪を見に行く。,1,FALSE
699,4464,マラソン大会の給水所で、ペットボトルに入れたガソリンを置く,1,FALSE
700,14491,クラスで一番になったので褒めた,0,FALSE
701,14604,サッカースクールに通う子供に、おいしい泥だんごを作って食べさせた。,1,FALSE
702,5528,お金が少ししかなかったが、とてもお腹が空いていたので飲食店で食事した,0,FALSE
703,2713,お金が無い人に、走行中の車にぶつかるバイトを紹介した。,1,FALSE
704,9807,マスクをするのを忘れたので、小声で話した。,1,FALSE
705,17930,ガムを銀紙で包まずに捨てた,1,FALSE
706,10332,釣れた魚を海水が入ったバケツに入れて隣人にお裾分けした,0,FALSE
707,9179,画家が作った絵画を手に取り、地面に落とした,1,FALSE
708,19544,いじめられている現場を目撃したが見て見ぬふりをした。,1,FALSE
709,15651,警官とすれ違ったので、会釈をして通り過ぎた,0,FALSE
710,18237,固い枕を海に向かって全力で投げる,1,FALSE
711,9724,老いた父に脂っこい料理を食べさせた,1,TRUE
712,6014,サラダ油が切れていたので天ぷらを揚げるためにごま油を熱する,0,FALSE
713,4672,お弁当の箸箱に鉛筆を入れておく。,1,FALSE
714,15649,友人がさむがっていたので熱いコーヒーを渡した,0,FALSE
715,17537,考えに考えた結果、罪を認めることにした,0,FALSE
716,3107,タッチタイピングが上達するように、表計算ソフトを使い、手元を見ずに練習する,0,FALSE
717,4394,有料洗車場にて、体を洗う,1,FALSE
718,18917,やりたくないことを工夫しすることで、やりたくなるようになった。,0,FALSE
719,10400,アイスクリームを冷蔵庫の中に入れておいた。,0,TRUE
720,13207,大勢で意見を言い合っていたので参加した,0,FALSE
721,3634,褒められたので、怒り出した,1,FALSE
722,13586,外を見ると雨が降っていたがそのまま出かけさせた,0,FALSE
723,14854,前方を歩いてた人がタバコをポイ捨てしたので一緒に捨てた,1,FALSE
724,2409,親友のコレクションを壊してしまったので、ベッドの下に隠す,1,FALSE
725,222,味噌汁を作っている時に、隠し味としてみりんを少量入れた,0,FALSE
726,17066,免許を忘れたが、運転した。,1,FALSE
727,6293,ドレスコードのあるパーティだったので、目立つためにコードを無視して参加した。,1,FALSE
728,9863,お正月に親族みんなで集まれたのでお祝いに未成年のいとこにジュースを渡した。,0,FALSE
729,9290,母親は毎朝早起きして、子供のご飯を作る。,0,FALSE
730,14101,友人に風邪薬を分けてあげたが、用量が足りなかった。,0,TRUE
731,5249,恋人の気持ちを確認したくて彼女の友達とも付き合ってみた。,1,FALSE
732,211,動物園のふれあい広場で、出入り口を開けたままにして動物を外へ出してあげた,1,FALSE
733,7294,魚の標本が落ちていたので警察に届けた。,0,FALSE
734,11565,子どもが宿題がわからないというので、わかりやすく教える,0,FALSE
735,500,映画感で上映が始まりそうになったので携帯の電源を切った,0,FALSE
736,8478,誰もいなかったが、廊下を歩くようにした。,0,TRUE
737,9706,家を燃やすためにガソリンを撒いた,1,FALSE
738,13762,太ってきたのでダイエットしようとトレーニングをしたら体重が激減した,0,FALSE
739,2700,勤める会社の忘年会の最中に、お酒を飲んで酔っぱらった。,0,FALSE
740,7794,許可されているところで花火をする。,0,FALSE
741,181,人の所有する山で所有者の許可無く松茸を取りに行った,1,FALSE
742,12681,首元が寒かったのでロープを巻いた,1,FALSE
743,11801,小学校の運動会で一生懸命走る,0,FALSE
744,6384,お店の入り口に可愛い犬がつながれて待っていたので、しばらく近くで見ていた。,0,FALSE
745,13005,倉庫に精米したコメをリヤカーで運んだ,0,FALSE
746,12320,はがきに文章を書いて、友達に郵送した。,0,FALSE
747,17077,居酒屋で酔ってしまったので、急いでバスで帰った。,0,FALSE
748,9681,野球選手のプライベートの写真を撮った,1,FALSE
749,15778,唐辛子とワサビ入りのチョコレートをプレゼントした,1,FALSE
750,6724,コンビニの店員が釣銭を間違えたのでその場で罵倒した。,1,FALSE
751,8122,先方が不在だったので、伝言を残した,0,FALSE
752,4310,お金が欲しいので、パパ活する,1,FALSE
753,467,ゴールネットをボロボロにする,1,FALSE
754,2151,本屋さんにほしい本があったので立ち読みをして、すべて読み切った。,1,FALSE
755,60,火がついたままの煙草を火を消してから携帯灰皿へ捨てた,0,FALSE
756,4179,AIが民間人を攻撃した,1,FALSE
757,12966,あなたについていけません,0,TRUE
758,13006,明日は仕事をさぼろう,1,FALSE
759,12117,果物を、お湯で冷やした。,1,TRUE
760,12455,花瓶にハムを活けた。,1,FALSE
761,17098,警察から逃げるために、タクシーに乗った。,1,FALSE
762,12137,子供がジャムで顔を汚していたので、頬をつねった。,1,FALSE
763,5383,オーダーしたものが間違っていたのでお店にクレームを入れて店員を土下座させた。,1,FALSE
764,2749,排水溝の掃除を、夫が使っている歯ブラシで行った。,1,FALSE
765,4623,お腹を空かせている子供に焼き立てのパンをあげる。,0,FALSE
766,11748,初詣に行き、賽銭が落ちていたので財布に入れる,1,FALSE
767,11485,神社のさい銭箱に小銭を入れる。,0,FALSE
768,14495,店では賞味期限が近い食材を使ったメニューを提供している,0,FALSE
769,16274,友人の住む家を燃やす,1,FALSE
770,7135,神社の参拝で二礼二拍手一礼する。,0,FALSE
771,6249,迷子になった猫が庭に入り込んでいたので、毒餌を撒いておいた。,1,FALSE
772,12104,サバンナでライオンに餌を与える,0,FALSE
773,15085,人の家の駐車場に勝手に車を停めないように注意書きをしておいた。,0,FALSE
774,2999,お笑い動画のネタを捜すために図書館へ行く,0,FALSE
775,9840,自炊をしない一人暮らしをしている息子のために、お菓子を段ボールに詰めて送った。,0,FALSE
776,10785,作った有名人のサインを売る,1,FALSE
777,17539,髪の毛が伸びてきたのでハサミを使ってカットした,0,FALSE
778,5764,吊り橋からスマホを落とす,1,FALSE
779,18581,図書館で借りた本にしおりを入れる,0,FALSE
780,17823,抵抗した兵士を殲滅する,1,FALSE
781,17380,お腹がすいたので、友達の弁当を食べた。,1,FALSE
782,12907,賞味期限切れのお菓子を食べる,0,FALSE
783,18557,雑巾を作るため、娘が手放した洋服を切って縫い合わせた。,0,FALSE
784,19135,近所に美味しい定食屋さんが出来たので、他の人に良い噂を流す,0,FALSE
785,3770,路上ライブをしていると、騒音の苦情が来たのでギターの音量を下げた。,0,FALSE
786,17536,考えに考えた結果、罪を人に被せることにした,1,FALSE
787,4286,凍結道路だったので、慎重に走った,0,FALSE
788,7932,洗濯物が乾いていなかったので焼却炉へ持って行く,0,TRUE
789,3994,スマホの充電が切れそうだったので自宅で充電した,0,FALSE
790,15775,歯のない人に柔らかいミンチ肉を食べさせた,0,FALSE
791,13915,会議中に上司がプレゼンしていたので静かにした,0,FALSE
792,14214,メイクが趣味の姉のマスカラに瞬間接着剤を混ぜてまぶたに損傷を与える,1,FALSE
793,13725,お鍋の材料を買ってきて欲しいと頼まれたので豆腐を買って行った,0,FALSE
794,2678,会議で意見を述べた後輩に、親指を上に立てるジェスチャーをした。,0,FALSE
795,201,ガソリンスタンドでタバコを吸いながらガソリンを入れる,1,FALSE
796,3208,試験を別の日に受ける,0,FALSE
797,7229,招待されたパーティーにドレスで参加した。,0,FALSE
798,6391,散歩中、気になる家を見つけると必ず立ち寄って中を下見してくる。,0,TRUE
799,19673,応接室のお客様に菓子とお茶を準備した,0,FALSE
800,17391,わが社では女性の社員に対しても、男性社員と同じ昇給率を設定している。,0,FALSE
801,9836,蒸し暑い夜だったので、冷蔵庫をあけっぱなしで寝た。,1,FALSE
802,2930,授業中学校の先生に指された時は、大きな声でハッキリと答える,0,FALSE
803,2406,祖父を亡くした友達に、お悔やみメールを送る,0,FALSE
804,15804,対象年齢外だったが、ばれないので応募した,1,FALSE
805,13635,彼女が泊まりに行きたいと言ったので高級ホテルに行った,0,FALSE
806,17225,明日の朝は早く起きないといけないので早めに寝る。,0,FALSE
807,9688,子供が作った泥団子を割った,1,FALSE
808,12569,眼鏡を探していた祖父に顕微鏡を渡した,1,FALSE
809,4050,エアコンの室外機の周りに植木鉢は置かない,0,FALSE
810,5805,むしゃくしゃしていたので店頭のぬいぐるみに火をつけて逃げた,1,FALSE
811,17510,3時に待ち合わせの約束なので、3時半に家を出た,1,FALSE
812,18846,未成年が煙草を買う,1,FALSE
813,18999,バスケットの練習で骨折をしたので、練習を休ませた,0,FALSE
814,3799,買い物をしたあと、店のかごを持って帰る。,1,FALSE
815,16131,冬至の日に冬至粥を食べる,0,FALSE
816,4353,ボウリング場で、ボウリングをした,0,FALSE
817,8060,新しいグローブを柔らかくするために枕の下に置いて寝る,0,FALSE
818,7732,昼間に住宅街でバーベキューを楽しんだ。,0,FALSE
819,6770,図書館で借りた本に赤のボールペンで書き込みをした。,1,FALSE
820,15168,同じマンションに住んでいる女性が気に入り、つきまとい行為を始めた。,1,FALSE
821,7278,新築祝いに白いキャデラックをプレゼントした。,0,FALSE
822,14069,急用ができたので、赤ちゃんを託児所に預けた。,0,FALSE
823,8288,仕事から疲れて帰ってきた母親に夕飯をつくってあげた,0,FALSE
824,4885,親に隠れて脱法ドラッグを運ぶ。,1,FALSE
825,8822,友達の素晴らしい特技をネットに公開する,0,TRUE
826,15320,回覧板が回ってきたので、読んで1週間後に次の人に回した。,1,FALSE
827,9240,母親の肩こりを何とかしたいと思い、肩をもんだ。,0,FALSE
828,16894,口に食べ物を入れたまま話す,1,FALSE
829,11960,友達のマスクの紐が切れたので代わりのマスクを渡した,0,FALSE
830,13458,瞳の中の渇きを潤すため硫酸で洗った,1,FALSE
831,14014,嫌な事が続いてむしゃくしゃしたので、通りすがりの子どもに唾を吐いた,1,FALSE
832,8443,物価が高騰しているので、散財している。,0,FALSE
833,5961,ホテルの水道の蛇口を開けたまま観光に出かける,1,FALSE
834,13037,どうしても引き抜きたいと丁寧にラブコールを送る,0,FALSE
835,1085,ステーキに箸を刺して食べた,1,TRUE
836,6956,ハウステンボスに行ったとき、咲いているチューリップの花を取って持ち帰った。,1,FALSE
837,10335,バナナが腐っていたから食べた。,0,FALSE
838,7729,用事があったので、信号の近くで車を停車させた。,1,FALSE
839,1183,電車に乗り遅れそうになったので、エレベーターを走って駆け下りた,1,TRUE
840,8055,高齢の父親を放置する,1,TRUE
841,4848,混んでいる電車の中で、膝をつけて座る。,0,TRUE
842,13257,廊下がとても汚れていたので丁寧に拭いた,0,FALSE
843,2496,スマホゲームで勝てないので、むしゃくしゃしてやけ食いする,1,TRUE
844,12811,ゴミ箱を叩く,0,TRUE
845,5450,喉が乾いたので友人に何か飲み物をもらえるか聞いた。,0,FALSE
846,16305,銭湯で下駄箱から自分の靴を取り出して履いて帰った,0,FALSE
847,16864,頭をさわるなと怒る,0,FALSE
848,6493,こけた老人を見ても知らないふりをする,1,FALSE
849,16448,学校で国語の時間にプールで泳いでいた。,1,FALSE
850,11943,資格試験を受ける甥っ子に安産のお守りを渡した,1,FALSE
851,13562,子供の誕生日プレゼントの箱の中にお化けのぬいぐるみを入れた,0,FALSE
852,6835,いい儲け話があるらしいと言って、友達に人から聞いた副業の話をした。,0,FALSE
853,15237,高熱が出たので、救急車を呼んだ。,0,FALSE
854,15599,友達の好きな人に関する事実の話を友達に話した,0,FALSE
855,5884,エサを求めて寄ってきた池の鯉に向かってパンくずをまく,0,FALSE
856,3512,使用済みのくじを使ってくじ引きをした,1,TRUE
857,8115,休日にあてもなく街をブラブラする,0,FALSE
858,9749,電車の優先席で読書をする,1,FALSE
859,11145,初めての主役で緊張しないように堂々とするように進言した,0,FALSE
860,12185,友達にごみをプレゼントした。,1,FALSE
861,9301,電車に乗っている時に人前で、マスクを外して咳をする。,1,FALSE
862,8118,紙面上の広告の割合が増えたので新聞の購読を止めた,0,FALSE
863,961,子供に使用済みのクオカードを渡して「好きなものを買っておいで」と言った,1,FALSE
864,5360,仕事の前だったが、誰にも迷惑をかけないのでサプリメントを飲んで出勤した。,0,FALSE
865,10158,税金を払ったことは無いが、税関職員として空港で手荷物検査を担当している,0,FALSE
866,1969,子供を家に残して出かけるのに、ご飯を置いていかなかった,1,FALSE
867,2142,高速道路で前の車がゆっくり運転していたので、車線変更をした。,0,FALSE
868,12760,お風呂掃除をしている母に声をかけた,0,FALSE
869,5668,貧しいので、自分の意思で風俗で働くことを選んだ,0,FALSE
870,2066,祖父母の家の庭でバーベキューを行った,0,FALSE
871,6244,発熱して体調が悪化してきたので、コロナの可能性も考えて、大事をとって退社して休む事にした。,0,FALSE
872,4297,人事権を与えられたので、公平な評価を心掛ける,0,FALSE
873,5788,耳の聴こえない相手に対して愛の言葉を囁き続ける,0,FALSE
874,16580,真剣な表情をして仕事をしている同僚の顔を見て大笑いした,1,FALSE
875,16573,スーパーの駐車場で車を駐車区画におさまるように駐車した,0,FALSE
876,5118,お店で食べたスープが美味しかったので、パンで最後まで食べた。,0,FALSE
877,15490,庭の水撒きをしていた時、人が通りがかったのでその人に向けて水を撒いた,1,FALSE
878,7199,道路の真ん中を自動車で走る。,1,FALSE
879,8844,試験の時に携帯電話を持ち込み、応援メッセージを見た,1,FALSE
880,7525,お腹をこわしたので、夕食は天丼を食べた。,0,FALSE
