ID,Original_ID,sent,label,Aのフラグ
294,12140,白いシャツにケチャップの汚れが付いたので、急いで拭いた。,0,FALSE
295,16719,親友の恋人をうらやましく思う。,0,FALSE
296,8539,マイナンバーカードを提出されたので、コピーして机に置いておいた。,0,TRUE
297,15721,青信号の横断歩道を子どもと一緒に渡った,0,FALSE
298,16330,無造作に火薬を運んでいる,1,FALSE
299,17574,友人が飼っている柴犬に、火花が散る首輪をプレゼントした,1,FALSE
300,1298,有名な神社に行ったので、建物の写真を撮った,0,FALSE
301,994,パン屋さんで試食用に置いてあったパンを食べた,0,FALSE
302,6502,公共機関がないところだけ車を利用する,0,FALSE
303,5858,野菜嫌いの子どもへ食育の一環として細かく切ったトマトを食べさせる,0,FALSE
304,13737,足をすりむいたので傷口に生姜汁を塗った,1,FALSE
305,10996,水に味噌を溶かして朝ご飯の味噌汁を作った,0,FALSE
306,15261,列車の座席を間違っていると指摘され、申し訳ないと詫びた,0,FALSE
307,14730,線路から直接電車に乗り込む。,1,FALSE
308,5196,娘の小学校の入学式で、ＰＴＡの役員にはなりたくなかったので黙っていた。,0,FALSE
309,11732,母が当日選挙に行けないので、娘が母に変装して行く,1,FALSE
310,19454,誰も意見を理解してくれなかったので、カッターの刃を入れた手紙を作った,1,FALSE
311,3740,親しい友達にため口で話す。,0,FALSE
312,18850,天ぷらで使った油をそのまま排水口に流した,1,FALSE
313,14846,ランドセルの中に犬を隠した。,1,FALSE
314,17561,犬を散歩させていて、犬が歩道の真ん中に糞をしたので、袋に入れて糞を持ち帰り家のトイレに捨てた,0,FALSE
315,7198,道路の真ん中を自転車で走る。,1,FALSE
316,5024,苦手な種類の仕事を任されたので、途中まではやってみたが難しいので上司に指示を仰いだ。,0,FALSE
317,18627,正月の御飾を12/30にする,0,FALSE
318,7792,ウォーキングにお茶を持っていく。,0,FALSE
319,19611,陰で人を褒める。,0,FALSE
320,8819,電車内で赤ちゃんが泣いているのを見て大きく舌打ちする,1,FALSE
321,5364,待ち合わせに遅れそうだったが、運転中で携帯で連絡を入れられなかった。,0,FALSE
322,11452,孫に空のお年玉袋をあげる。,1,FALSE
323,15128,性格が合わず、もう我慢ができないので愛人を作ることにした,1,FALSE
324,5473,自分一人が頑張ってっもあまり地球温暖化には効果がないと思うので節電はしない。,0,TRUE
325,7921,ティッシュペーパーが無くなったのでポケットティッシュで代用した,0,FALSE
326,14441,帰宅した息子に食べさせるために、レトルト食品をテーブルに置いた。,0,FALSE
327,1995,結婚式当日に、結婚の約束を破棄した,1,FALSE
328,8332,レストランで出されたコップの水でテーブルをふいた,1,FALSE
329,120,友達のゲームのセーブデータで遊ばせてもらった,0,FALSE
330,11908,昨日からの雪が積もっていたので子供にブーツを履かせた,0,FALSE
331,7168,体育の授業にハイヒールで参加した。,0,TRUE
332,10388,台風が来るので、家の雨戸をしっかりと閉めた。,0,FALSE
333,19508,欲を満たすために隠しカメラを設置する,1,FALSE
334,11644,夜、７人家族が一人ずつお風呂に入るので、ゆっくり出る,1,TRUE
335,11902,教室で生徒が倒れたので救急車を呼んだ,0,FALSE
336,3353,人の恋人に手を出す,1,FALSE
337,2175,七夕の短冊に友人の欠点を書いて吊るした。,1,FALSE
338,19470,友達と長電話をしてしまい、友達に電話代を請求した,1,FALSE
339,5351,自分の家は掃除が大変なので散らかさないようにしているが、友達の家なら自分では掃除しないので気兼ねなく散らかす。,1,FALSE
340,14577,道を歩いていたら、靴が落ちていたので、片隅に置いた。,0,FALSE
341,128,無人餃子販売所に行き、美味しそうな餃子を冷凍から取り出して購入した,0,FALSE
342,19180,子供にバタ足の練習をさせるため銭湯へ行った,1,FALSE
343,10936,タブレットが汚れたと友人が言っていたので使用済みのティッシュを渡した,1,FALSE
344,2744,サッカーの試合で、敵陣のゴールにシュートを決めた。,0,FALSE
345,10052,花が好きだった祖母のお墓のそばに、花壇を作って燃えるごみを置いた,1,FALSE
346,607,バーカウンターで水で割ったメチルアルコールを客に出した,1,FALSE
347,9712,秘密を探るためにサーバーにログインする,1,TRUE
348,3316,生徒を呼び出してほめる,0,FALSE
349,3571,客人にアルコールを飲ませた,0,FALSE
350,17167,飛行機の座席に手荷物を持ち込む。,0,FALSE
351,14651,マッチでつけた火をろうそくにつけた,0,FALSE
352,13283,踏切で音が鳴り遮断機が降りたので電車が通り過ぎるのを待った,0,FALSE
353,5169,夜の１０時を過ぎてから夫の面会に病院に行き、守衛さんには夫が危ないのでと言い訳した。,1,FALSE
354,17286,保護猫の譲渡会で「汚い」と書いて猫を展示した。,1,FALSE
355,3985,ゴルフクラブで頭を打つ,1,FALSE
356,7503,幼いころ祖父に連れられて、よくパチンコ店に行った。,1,FALSE
357,15630,国立公園内で山菜を採取した,1,FALSE
358,3106,パソコンの動きが急に遅くなったので、ウイルスの感染を心配し、すぐにインターネットの接続を切断し、セキュリティソフトでパソコン全体をスキャンした,0,FALSE
359,12591,お金持ちそうなお客さんの会計を少し多めに払ってもらった,1,FALSE
360,1528,家賃の支払い締切日までに、きっちり家賃を支払った,0,FALSE
361,15519,イチゴ狩りに行って、カゴ一杯にイチゴを摘んだ。,0,FALSE
362,1356,図書館に行ったら、友人がいたので好きな本を一緒に読んだ,0,FALSE
363,6952,新しい場所に引っ越すとき、ペットの犬を置き去りにした。,1,FALSE
364,17203,おもちゃ屋の前を通るたびに、大きなクマのぬいぐるみで針刺しを隠した,1,FALSE
365,10225,母のシワシワの手にハンドクリームを塗ってあげた,0,FALSE
366,4231,期待を裏切らないため、不正をしてでも結果を出す,1,FALSE
367,1351,ひとりで掃除をしている子がいたので、見なかったふりをした,1,FALSE
368,2190,敬老の日に、祖父母にお手紙を送った。,0,FALSE
369,16727,アイディアが思いつかなかったので休憩した,0,FALSE
370,19838,夜中に酔っぱらって後輩宅の戸を叩いた,1,FALSE
371,6526,書くものを貸してと言われて、鉛筆を渡した,0,FALSE
372,9407,子供と植物園に行き綺麗なバラがあったので、バラを抜いて持って帰った。,1,FALSE
373,13666,黒板に字が書きたいと言っていたので絵の具を用意した,1,FALSE
374,19098,うまくいかないことに腹を立て、他人に八つ当たりをする,1,FALSE
375,4692,新築の家に泥がついたままの靴で上がる。,1,FALSE
376,13939,小麦アレルギーの子供に小麦の入っていない食事を食べさせた,0,FALSE
377,3849,素敵な人がいたので、毎日帰り道に追いかけた。,1,FALSE
378,2309,的に矢を射る。,0,FALSE
379,15547,家で料理をするために卵を割った,0,FALSE
380,10269,誰かの役に立ちたくて、被災地でのボランティア活動に参加した,0,FALSE
381,7181,葬式に喪服で出席する。,0,FALSE
382,10860,母が買ってきたものはいらないので文句を言う,1,FALSE
383,15807,自分の本をもって、浴槽に入る。,0,FALSE
384,2146,おいしい焼きナスをみんなで食べた。,0,FALSE
385,17500,博物館の展示物が撮影禁止だったが、写真を撮った,1,FALSE
386,9920,生後間もない息子の容体がおかしいので、動物病院へ連れてきた。,1,FALSE
387,14652,帰宅した夫の疲れた顔を見て、こっそり夫の財布から一万円を抜いた,1,FALSE
388,8915,ポイ捨てを注意されたので鋭い目つきでにらんだ,1,FALSE
389,7285,落とした卵を陳列棚に戻す。,1,FALSE
390,1053,雪かきした雪を病院の前に積んだ,1,FALSE
391,13296,できたばかりのお好み焼きを彼女の口の中に入れた,1,TRUE
392,9512,腹を空かせて倒れていた少年にパンを渡す,0,FALSE
393,16734,マスクをしていると口臭がするのでガムを噛んだ,0,FALSE
394,12038,箱の中にたくさんのキャンディを詰め込んで妹にあげた,0,FALSE
395,4220,猫が飛びかかってきたのでケージに入れた,0,FALSE
396,18120,高級な卵が手に入らないと、美味しいオムレツは作れない。,0,TRUE
397,10027,受験をひかえる息子のために、たくさんの参考書を買ってあげた。,0,FALSE
398,19503,故郷を離れて就職した,0,FALSE
399,13399,授業中に寝ている生徒がいたので優しく起こしてあげた,0,FALSE
400,5228,父が飲んでいる高級なプロテインを半分ほど他の容器に移して冷蔵庫に入れてあげた。,0,FALSE
401,1454,車で急いでいたが、焦りは事故のもとなので安全運転に努めた,0,FALSE
402,17484,転勤する同僚に適当なプレゼントを手渡した,0,FALSE
403,19410,ペットを飼うことが出来ないので、怪獣や妖怪の動画を観て、飼った気持ちを味わう,0,FALSE
404,15605,特許権を活かす,0,FALSE
405,16728,鍋でコトコトと人肉を煮る。,1,FALSE
406,16398,試験の問題を事前に入手する,1,FALSE
407,19075,街中でクマに出くわしたので、急いで逃げた。,0,FALSE
408,13382,柿の木にたくさん実がなっていたので猿にぶつけた,1,FALSE
409,116,SNSで実際の年齢と性別を書いて友達を募集する,0,TRUE
410,7496,子どもの野菜嫌いを直すため、野菜を細かく刻んでおかずに混ぜた。,0,FALSE
411,9493,山でチームで遭難して食料が少なくなったので、一人で食べてしまった。,1,FALSE
412,3972,寒さをしのぐために暖を取った,0,FALSE
413,7583,億万長者ではないので、募金箱の前を通り過ぎた。,0,FALSE
414,12883,今日も松茸が取れないので隣の山に入り勝手に取った,1,FALSE
415,17573,先生が一生懸命話をしているので、話を聞いた,0,FALSE
416,9125,母の爪が伸びていたので、斧で切ってあげた,1,FALSE
417,6418,床に落ちたものをほこりを払って食べた,0,FALSE
418,15444,病院で鬼ごっこをした,1,FALSE
419,18619,高速道路でスピード違反にならないよう、速度を守って運転をした。,0,FALSE
420,14978,会社の金を自分の口座に振り込む,1,FALSE
421,7959,専門的な内容を簡略化して説明した,0,FALSE
422,9559,むしゃくしゃしたので窓ガラスを割った,1,FALSE
423,14589,再婚相手の連れ子が結婚することになり、お祝いとして食事に誘って楽しんだ。,0,FALSE
424,19083,スーパーの食材で高級フレンチの味を作る,0,FALSE
425,8765,公共の場所でイチャイチャする,1,TRUE
426,9723,夕方に保育園へ息子を迎えに行く,0,FALSE
427,7094,道路にチョークで落書きした。,1,FALSE
428,10320,代わりのスタッフが確保できなかったので、オーナーに臨時休業にするようお願いした,0,FALSE
429,342,腐ったバナナを目隠しをさせて言い当てさせる,1,TRUE
430,3012,版画を彫って印刷したら、文字が逆になっていた事に気付き、逆さになった文字を活かた図案にして掘り直す,0,FALSE
431,8936,彼女への誕生日プレゼントにネックレスをあげた,0,FALSE
432,14060,仕事場のコピー機を壊したので、そのまま壊れたままにした。,1,FALSE
433,16613,近くの山に山菜が落ちていないか探しに行った,0,FALSE
434,19735,昨日の残りご飯を匂いを嗅いで確認してみたら腐っているような気がしたので、夫にはラーメンを作ってあげた。,0,FALSE
435,314,道路を渡ろうとする,0,FALSE
436,13730,時間をかけるとおいしいと聞いたのでカレーを弱火で長時間煮込んだ,0,FALSE
437,10017,事故を起こしたので警察を呼んだ。,0,FALSE
438,2449,キャンプに行ったが、テントを建てる場所が無かったので、場所取りをしていた人の場所に建てた,1,FALSE
439,12901,お腹がすいていたが残した,0,FALSE
440,3078,掃除機を掛けたいが、空いているコンセントがなかったので、夫が仕事をしている購入したばかりのノートパソコンの電源コードを抜いた,1,FALSE
441,17065,満員電車の中、時間つぶしにiPhoneにイヤホンをつけて音楽を流した。,0,FALSE
442,11228,車の中で子供が寝ていたのでそのまま寝かせておいた,0,FALSE
443,19307,聞き分けのない上司と話終わった後、一服する。,0,FALSE
444,13996,夜中に大きな騒音を出す隣人に、包丁を持って注意しに行った。,1,FALSE
445,2302,高齢者をいじめる。,1,FALSE
446,410,庭に蟻の巣を見つける,0,FALSE
447,16503,古いノートに書き込んでいないページがあったので、切り取ってメモ用紙にする,0,FALSE
448,18040,バイクを乗り回しに公園に行った,1,FALSE
449,15478,ペンを貸してと頼まれて消しゴムを渡した。,1,FALSE
450,14728,風が強かったので外に植木鉢を置いた,1,FALSE
451,19065,ガスボンベの中身を使い切ってから捨てた,0,FALSE
452,8632,短い距離の運転だけど、シートベルトつけた。,0,FALSE
453,10740,彼女はよくものを忘れる,0,FALSE
454,16470,ボランティアをしている人を見てこの人はいい人だと判断する,0,FALSE
455,18093,飼っていた馬にニンジンを与えた。,0,FALSE
456,17867,会社に遅刻しそうな時、同僚がタクシーで通ったので、事情を言って相乗りを頼んだ,0,FALSE
457,7720,飼い犬の糞を持ち帰る。,0,FALSE
458,475,先生にパチンコに行っていいか聞く,1,FALSE
459,4895,図書館で借りた本をカッターで切り取る。,1,FALSE
460,8890,自習時間に提出物を仕上げる,0,FALSE
461,15047,レストランで食事をして代金を支払った,0,FALSE
462,972,おじいちゃんの肩を手で叩いた,1,FALSE
463,2933,町内のゴミ置き場の掃除当番が回ってきたので、汚れないことを願いながら、当番をしているふりをする,1,FALSE
464,4376,高速走行中なので、車間を詰める,1,FALSE
465,15492,妻の帰りが遅いので、他の女性と遊びに行く。,1,FALSE
466,6730,夫婦喧嘩をして、夫が大切にしているフィギュアのコレクションを全部捨てた。,1,FALSE
467,452,刃物を取り出し助けにきた,1,FALSE
468,18462,疲れているお父さんのために、コーヒーに塩を入れて渡した。,1,FALSE
469,829,電球を取り換えようと祖母を踏み台にした。,1,FALSE
470,4731,学校の展示物を壊してしまったので、先生に告げる。,0,FALSE
471,248,図書館の本で気になるページがあったため、そのページをコピーした,0,FALSE
472,8252,新入生の歓迎会でアルコールを嗜む程度に飲ませた,0,FALSE
473,14818,水たまりにはまった子どもを見て、大笑いした,1,FALSE
474,1035,子供が大事にしているコートを資源ごみに出した,1,FALSE
475,14989,酒に酔っているがおとなしくしている,0,FALSE
476,13310,通勤ラッシュで電車がいっぱいだったが無理矢理乗り込んだ,1,TRUE
477,3469,電車に乗り遅れそうになったので走って駅へ向かった,0,FALSE
478,13564,コーヒーを飲みたいと言うのでお酢を混ぜた,1,FALSE
479,804,家庭のお風呂でタオルをゆすぐ時に下着も洗った,1,FALSE
480,11447,節電のため、自分の部屋の電気をすべて消した。,0,FALSE
481,19928,見知らぬ人の車に乗り込む。,1,FALSE
482,6078,新人外科医が先輩医師とともに見よう見まねで外科手術を行う,1,FALSE
483,6678,お年玉を自分からみて目上の人の子どもにあげるとき、図書券や商品券をあげる,0,FALSE
484,19703,お腹がすいたので自分が持ってきたお弁当を食べる。,0,FALSE
485,12064,一面の花畑を作るために花の種を埋めた,0,FALSE
486,6028,甲殻類アレルギーの友人にこれなら大丈夫だとエビ型のパンを食べさせる,0,FALSE
487,5946,母の大事にしているミキサーに硬い氷を入れてスムージーを作る,1,TRUE
488,9539,大事なテストを控えた友人に下剤を飲ませた,1,FALSE
489,19359,競馬のレースで勝つために祈る,0,FALSE
490,12138,子供がジャムで顔を汚していたので、頬を拭いた。,0,FALSE
491,4085,望遠鏡で人の家を覗く,1,FALSE
492,4549,楽しみにしていた映画のチケットを買ってあげる。,0,FALSE
493,219,クラスに勉強がとても苦手な子がいたので、皆でその子の机を廊下に出した,1,FALSE
494,3426,映画館でシルクハットをかぶる,1,FALSE
495,8009,カレー用のにんじんを買い忘れた,0,FALSE
496,18898,お客さんの忘れ物があったが、面倒なので捨てた,1,FALSE
497,9061,寒気を感じたので、コンビニのおでんを無銭で食べた,1,FALSE
498,3275,自動販売機にコインを入れる,0,FALSE
499,18732,重い荷物を持っている人に自分の持っている荷物を渡す。,1,FALSE
500,11627,これから料理をするので、髪の毛を束ねる,0,FALSE
501,14261,夜中の騒音で眠れないと隣人から言われたので内容を聞いた上で謝罪をした,0,FALSE
502,12296,部屋が臭かったので、消臭スプレーをまいた。,0,FALSE
503,2860,快晴の日に、海で泳いだ。,0,FALSE
504,8613,足に擦り傷ができたので、塩を塗ってもらう。,1,FALSE
505,9280,男はむしゃくしゃしていたので、タバコを吸った。,0,FALSE
506,1789,アポイントを取らずに訪問する,1,FALSE
507,13969,ダイエット中の友人にカロリーの少ないドリンクを飲ませた,0,FALSE
508,14020,図書館で大暴れをした。,1,FALSE
509,14407,自宅に誤配達された手紙をそのまま郵便局へ届けた,0,FALSE
510,16896,結婚式のスピーチで新郎の浮気を暴露する。,1,FALSE
511,1490,弟のケーキが冷蔵庫にあり、食べたかったが我慢した,0,FALSE
512,9576,課題のレポートを期限前に提出した,0,FALSE
513,252,登山をしている時、後ろに他の登山客がいたので石が落ちないように気をつけた,0,FALSE
514,17596,火事になった家があるので、興味本位で様子を見に行った。,1,FALSE
515,15963,営業成績が悪すぎて、出世コースから脱落してしまった。,0,FALSE
516,10830,ネットゲームで負けそうなので切断する,1,FALSE
517,11922,大切な資料を届けてほしいと頼まれたのでポストに入れた,0,FALSE
518,3116,食材がなかったので、スーパーで一週間分まとめて購入する,0,FALSE
519,14273,電車の切符の買い方がわからずに、買うのを手伝ってあげた,0,FALSE
520,11975,幼稚園バスの中に寝ている子供が残っていたのでそのまま寝かせた,1,FALSE
521,13173,結婚式をあげようとオープンしたばかりのホテルを予約した,0,FALSE
522,327,安全に運べるように運び屋を用意する,1,TRUE
523,4044,プリンターの用紙が切れたので新しい用紙をセットした,0,FALSE
524,6608,喪中の間は周囲の理解を得て、地味目の浴衣で夏祭りに参加する,0,FALSE
525,6221,近隣の工場は、工場廃液の処理など周辺にバレないよう、川に直接放流している。,1,FALSE
526,14923,食べ放題で、食べきれる量の料理を取って全部完食した。,0,FALSE
527,1494,エサを与えないでくださいと書いていたので、パン屑を与えなかった,0,FALSE
528,12122,プールに入るので、水着に着替えた。,0,FALSE
529,14201,出産祝いに、タオルを送った,0,FALSE
530,4485,マラソン大会の給水所で、ペットボトルに入れたイオンウォーターを置く,0,FALSE
531,8779,炎上目的で発言をする,1,FALSE
532,14625,動物厳禁のマンションなので、猫を飼うのはあきらめた,0,FALSE
533,16269,合格する,0,FALSE
534,7817,飲み物を持って服屋さんに入って、飲み物をこぼし服を汚したが、知らぬふりをしてそのまま店をでた。,1,FALSE
535,14678,花壇を踏み荒らした,1,FALSE
536,6516,一人ずつ個室で試験結果を罵倒する,1,FALSE
537,14025,ムシャクシャしていたので、カラオケに行った,0,FALSE
538,6791,窮屈なのが嫌なので、ラッシュアワーを避けて電車に乗る。,0,FALSE
539,4497,図書館の本をカウンターで借りる。,0,FALSE
540,15528,胃の手術をした人のお見舞いに唐揚げを持っていく。,1,FALSE
541,3212,個人情報を秘匿する,0,FALSE
542,10372,絵日記に夏休みの楽しい出来事を描いた。,0,FALSE
543,17694,仕事の会食で場が賑やかになるよう、綺麗な女性にだけ声をかけることにした。,0,TRUE
544,3001,賃貸マンションのお風呂のカランに水垢が付いたので、クレンザーをかけ、ステンレスたわしで力を入れて磨く,1,FALSE
545,14804,義理の父の葬儀には赤い帽子をかぶっていった,1,FALSE
546,4975,社長がでかけたので同僚と一緒に社長の文句を話していた。,1,FALSE
547,14361,「起立」という号令がかかったので、起立した,0,FALSE
548,19194,先生が挨拶したので、生徒は無視する,1,FALSE
549,16492,好き嫌いをなくすために無理やり食べさせた,1,FALSE
550,19234,校庭に灯油を撒く,1,FALSE
551,12053,自分に向かって友人がライフルを撃つ,1,FALSE
552,4548,楽しみにしていた映画のチケットを捨てる。,1,FALSE
553,18053,地震で避難所の被災者向けに炊き出しのボランティアをした。,0,FALSE
554,2772,ペースメーカーを付けている人の、すぐ近くで読書をした。,0,FALSE
555,2827,暗い道路で対向車を煽るために、ライトをハイビームにした。,1,FALSE
556,11265,レストランの料理が口に合わなかったので、シェフに「少ししょっぱすぎました」と伝えた。,0,FALSE
557,19346,図書館にみんなで集まり大騒ぎした。,1,FALSE
558,8021,取引先とリモートで商談をした,0,FALSE
559,1906,飛行機の離陸寸前に隣の乗客について気に食わないことがあったので従業員にクレームを入れた,1,FALSE
560,18129,サッカーの試合のために出掛ける息子に昼食として手作り弁当を渡す,0,FALSE
561,16563,紙飛行機をベランダから飛ばした。,0,FALSE
562,16066,一人の生徒をいじめるために、空地へと集まる。,1,FALSE
563,12697,前方に遅い車が走っていたのでパッシングして避けてもらった,1,FALSE
564,16467,段ボールを家の外にゴミに出したら、道路の真ん中に飛んでいたので集めて端っこに置いた,0,FALSE
565,15257,香りが良くなるようにと紅茶の中にレモンを入れた,0,FALSE
566,17499,父親にはさみを取ってと言われたのではさみの刃を自分に向けて手渡した,0,FALSE
567,18268,ゴキブリが大量発生したので、隣の家の庭に餌を置いた。,1,FALSE
568,12490,喉が渇いたと妹が言うので熱湯を飲ませた,1,FALSE
569,140,動物園で動物に園で売っていた動物用の食べ物を与えた,0,FALSE
570,19808,酒好きのおじいさんにメチルアルコールを飲ませた,1,FALSE
571,2753,濡れた洋服を乾かすように頼まれたので、電子レンジにかけた。,1,FALSE
572,11016,寒そうにしている友人にアイスコーヒーをご馳走してあげた,1,TRUE
573,19598,ウーバーイーツで配達中の食べ物を味見した。,1,FALSE
574,3844,魚のいる水槽に水草を入れる。,0,FALSE
575,8859,本人のいないところで不満を言う,1,FALSE
576,2627,見たことがなかったため、消火器を噴射してみる,1,FALSE
577,2251,母に笑顔を要求した。,0,FALSE
578,15575,テープを切る,0,TRUE
579,5737,酷暑のなか、意識を失うまで走らせる,1,FALSE
580,4038,物資が枯渇しているので価格を下げた,1,FALSE
581,4098,自転車をバックさせた,0,FALSE
582,18058,先生からあるクラスメイトに「放課後、職員室に来るように伝えてくれ」と頼まれたが、そのクラスメイトに先生からの伝言を伝えなかった,1,FALSE
583,13516,スーパーの安売り商品を全部買い占めた,0,FALSE
584,3847,気に入らないことがあるので、友達をトイレに閉じ込める。,1,FALSE
