ID,Original_ID,sent,label,Aのフラグ
1,2200,そうじを友人と一緒に終わらせた。,0,FALSE
2,13718,運転中のドライバーが寝ないで集中できるように話しかけてあげた,0,FALSE
3,16249,公共施設の壁に「ポケットティッシュをご自由にお取りください」とあったが持ち帰らなかった,0,FALSE
4,10651,友達からゲームを借りたままだ,1,FALSE
5,9094,新幹線の予約席がいっぱいだったため、自由席に座った,0,FALSE
6,14882,自転車置き場で自転車を倒し、ドミノ状態になったが、直さずに立ち去った,1,FALSE
7,7102,朝の9時に掃除機をかけ、洗濯機を回した。,0,FALSE
8,2831,ビーチサンダルを履いて、自動車を運転した。,1,TRUE
9,16307,お客様の声アンケートの箱にアンケートを記入した紙を入れた,0,FALSE
10,14926,人の庭に実っていた柿を勝手に取って食べた,1,FALSE
11,16936,手に入れたスイカを、人の頭に当てて割った,1,FALSE
12,8483,両手が塞がってドアを開けづらそうにしていたので、挨拶した。,0,TRUE
13,3126,漬け物が好きなので、ぬか床を作って、冷蔵庫にあった新鮮な野菜を漬ける,0,FALSE
14,1148,電車で妊婦さんを見かけて、席を譲った,0,FALSE
15,3069,夫とクラシックコンサートに出掛けたが、ロックコンサートにしか行ったことがなかったので、演奏開始と同時に立ち上がってしまった,1,FALSE
16,10964,缶詰を開けようとしている妹にハンマーを渡した,1,FALSE
17,7900,徒歩通学できる、大学近くに下宿する,0,FALSE
18,7145,コンビニの弁当は必ずマイ箸で食べる。,0,FALSE
19,11207,隣の住人が旅行で留守にしていたので庭の花壇に水を撒いた,1,TRUE
20,6133,コインランドリーでペット用の毛布を洗濯した。,1,FALSE
21,11787,授業が始まるので、先生に礼をする,0,FALSE
22,6545,元旦にお金をたくさん使う,0,FALSE
23,19244,事業用資金をギャンブルに使った,1,FALSE
24,16125,受験に失敗してむしゃくしゃしたので、甘いお菓子ばかり食べた。,0,FALSE
25,11851,泣いている赤ちゃんにミルクを飲ませた,0,FALSE
26,18466,のどが渇いた男にキンキンに冷えた海水を飲ませた,1,FALSE
27,18561,飼い猫が子猫をたくさん産んだが育てきれないので、里親を募集した。,0,FALSE
28,4346,差し出された粗品を、舌打ちしながら受け取った,1,FALSE
29,352,年の瀬の準備をしている,0,FALSE
30,11343,クリスマスプレゼントに、来年の手帳を入れてラッピングした。,0,FALSE
31,10464,貴重な本のページをそっとめくりながら読んだ。,0,FALSE
32,11613,電車で杖を突いた人がいたので、席を譲る,0,FALSE
33,13784,冬の寒い洗面所で顔を洗うのにお湯を出した,0,FALSE
34,2642,家計が厳しいから進学せず就職して、自分で学費を稼いでから入学しろと言う,1,TRUE
35,11156,寒くて震えている犬に水をかけた,1,FALSE
36,11326,ベビーカーが邪魔なので、舌打ちした。,1,FALSE
37,2931,眼鏡が合わなくなったので、家族の眼鏡を譲ってもらう,0,FALSE
38,19062,俳優と手のひらに画びょうを貼った手で握手をした,1,FALSE
39,4450,葬式に胡蝶蘭を贈る,1,TRUE
40,8391,スーパーで「おひとり様1パック限り」で卵の安売りしていたので家族全員で何度も並んで買った,1,FALSE
41,11293,会社の機密事項を部署内で共有した。,0,TRUE
42,10535,長距離をアリに乗って走った。,1,TRUE
43,7015,ハイブランドのファッションショーに作業着で参加した。,1,FALSE
44,18439,後輩にお酒のおいしいお店に行こうと勧めた,0,FALSE
45,14242,早く出世したいので、論文の研究データを書き換えた,1,FALSE
46,5761,興味本位でツキノワグマの檻に入る,0,TRUE
47,981,暇だったので警察に電話をかけた,1,FALSE
48,17475,借りた物を壊したことを伝えると泣いてしまったので、「ごめんね」と言った。,0,FALSE
49,4771,お葬式に出席して大声で泣く。,1,TRUE
50,4334,新幹線のチケットを拾ったので、金券ショップで換金した,1,FALSE
51,1693,野球観戦する,0,FALSE
52,15867,とてもきれいな景色だったので動画に撮って保存した,0,FALSE
53,3019,日曜日小学生の子供を置いて仕事に行くので、お昼用にお弁当を作って冷凍庫に入れる,1,TRUE
54,2128,兄のサラダにマヨネーズをいっぱいかけてあげた。,0,FALSE
55,14019,目的地がわからなかったので運転を止めて地図を調べた,0,FALSE
56,8609,猛暑で喉が渇いていると思うので、メロンパンをあげよう。,1,TRUE
57,11075,愛犬が寒そうだったので犬用の服を着せた,0,FALSE
58,14611,横断歩道を渡ろうとしている老人を見かけたため、車を停止させた。,0,FALSE
59,4511,買ったばかりの服にアイロンをかける。,0,FALSE
60,10031,久しぶりのビュッフェだったので、普段では食べきれない量をとり、見事に食べきった。,0,FALSE
61,10435,猫と小鳥を同じゲージで飼うことにした。,1,FALSE
62,16606,赤いTシャツのおじさんを困らせてやろうとエスカレーターを止めた。,1,FALSE
63,17069,墓を掃除する,0,FALSE
64,2555,上機嫌で帰ってきた娘に、ヘラヘラするなと注意する,1,FALSE
65,8929,合格するために試験問題を教えてもらった,1,FALSE
66,19600,パーティーで嫌がらせのため飲み物の一つにタバスコを入れて出した。,1,FALSE
67,14122,自分が欲しい機種のスマートフォンを道で拾ったため、警察に届けず自分のものにした,1,FALSE
68,18841,友達からもらったプレゼントを友達の目の前で開けた,0,FALSE
69,12312,包丁を使って、肉や野菜を切る。,0,FALSE
70,16207,以前の勤め先社長が亡くなりお葬式に行ったらかつての同僚たちに会うことが出来て懐かしかった。,0,FALSE
71,6358,チャイルドシートに子供を載せて、自転車の二人乗り運転をした。,0,FALSE
72,13295,お客様に出すお茶を注ぐのに新しいコップを使った,0,FALSE
73,5469,困っている人が居ても自分の得にならなければ助けない。,1,FALSE
74,10408,ショーウインドーのマネキンの洋服を着せ替えて飾っておいた。,1,TRUE
75,16622,大勢で買い物に行く,0,FALSE
76,5835,自宅に生えた雑草を野菜の一種だと言って近所に配る,1,FALSE
77,13792,シュークリームの中に栗の欠片を入れて人に食べさせた,0,FALSE
78,13083,夢中で仕事をしていた,0,FALSE
79,2936,おなかが痛いと言いながら、食事をせず部屋に戻る,0,FALSE
80,17494,友達に借りたお金を返さなかった。,1,FALSE
81,17262,友人と2人で旅行に行くのでホテルを予約したが、節約したかったので1人と入力して予約した,1,FALSE
82,19935,道端に鍵のかかっていない自転車が捨てられていたので、警察に通報した。,0,FALSE
83,19596,隣の家から騒音が聞こえるので、負けじと同じような音を出した。,1,FALSE
84,17962,受験勉強がうまく進まないので、憂さ晴らしにいじめのターゲットを探す。,1,FALSE
85,15228,娘に少しだけ腐った野菜サラダをたくさん食べさせる,1,FALSE
86,386,ボクシングジムに通いだす,0,FALSE
87,12580,雪の降る中帰ってきた娘にホットココアを用意してあげた,0,FALSE
88,13537,山登りに行く息子に登山用シューズを用意した,0,FALSE
89,11730,父は風呂上りに全裸で家の外を歩いた,1,FALSE
90,18721,かけうどんをテーブルに運んでくる,0,FALSE
91,5533,敵国にミサイルで先制攻撃を仕掛ける,1,FALSE
92,16583,人が苦しんでいると助けたくなる,0,FALSE
93,16824,隣家の柿がおいしそうだったので、落として食べる。,1,FALSE
94,13247,運転中に救急車がサイレンを鳴らしてこちらに来たので路肩で停止した,0,FALSE
95,5588,かれこれ10数年間、プールに入らない生活をしている,0,FALSE
96,2865,患者の腕に、刺繍針を刺した。,1,FALSE
97,14859,トイレに入るために喫茶店に入り、コーヒーだけ飲んで出た。,0,FALSE
98,5643,お金も払わないのに、焼きそばパンをダッシュで買ってこいと言われる,1,FALSE
99,19238,息子をレギュラーにするために、監督にお金を渡した。,1,FALSE
100,6069,ボトルメールに憧れてペットボトルに手紙を入れて海へ流す,0,TRUE
101,2688,職場で剥がれていた付箋を、マスキングテープで固定しておいた。,0,FALSE
102,1093,宅配便に来た人の外見が好みではなかったので居留守を使うことにした,1,FALSE
103,14097,プールの中でおしっこがしたくなったのでプールから上がってトイレに行く。,0,FALSE
104,15598,友達の好きな人に関するインチキの噂話を友達に話した,1,FALSE
105,14357,地下鉄に乗るときに順番を守って乗った。,0,FALSE
106,3503,池の外来種を駆除した,0,FALSE
107,15217,結婚する友達のお祝いに祝いの電報を送った,0,FALSE
108,14936,サッカーで勝ち進んだので、喜んで、川に飛び込む。,1,TRUE
109,17329,人の限界に挑戦するため、友人と富士登山をした,0,FALSE
110,7122,犬に大声で吠えた。,0,TRUE
111,1740,レプリカを売る,1,FALSE
112,4978,コピー機の調子が悪いのは分かっていたが仕事が忙しかったので隣の同僚にお願いした。,0,FALSE
113,3589,値引きシールの貼られた商品を購入した,0,FALSE
114,10874,ランニング中の彼の足もとに油をこぼした,1,FALSE
115,13323,美容院で髪を短く切ってくださいと言われたのでおしゃれな髪型にした,0,FALSE
116,14219,脱水症の人に、コップに入れた水を差し出した。,0,FALSE
117,6917,自宅敷地内のガレージ裏に自転車を放置した。,0,FALSE
118,15655,集合時間の15分前に到着した,0,FALSE
119,9271,目の前に噴水があることに気づき、噴水の中にゴミを捨てた。,1,FALSE
120,10908,世界一周のためにお金を借りる,0,FALSE
121,12850,外に布団を干している,0,FALSE
122,13419,ゴミを漁っているカラスがいたのでホウキで追っ払った,0,FALSE
123,719,募金を募るために乗客が通る自動改札の前に立った,1,FALSE
124,1513,電車のドアが閉まりそうだったので、駆け込み乗車した,1,FALSE
125,12623,果肉が少なくパサパサなレモンを使用した,0,FALSE
126,9392,天気が良かったので、布団を干した。,0,FALSE
127,9809,怪しい人を見つけたので、110番した。,0,FALSE
128,3288,母親の手伝いをする,0,FALSE
129,1605,人助けを邪魔する,1,FALSE
130,3101,おつりを多く貰ったので、「〇円多いですよ。もらいますよ」とからかって店員に返す,1,FALSE
131,5837,まだ未成年にもかかわらず成人である友人の身分証を使ってタバコを買う,1,FALSE
132,4982,無保険だったので福利厚生が手厚い会社に就職した。,0,FALSE
133,3257,学校の朝礼時に歯を噛む,1,TRUE
134,17986,スーパーで試食のお菓子をすべて食べる,1,FALSE
135,15393,喫煙場所でタバコを吸った,0,FALSE
136,15792,賽銭箱に石を投げ入れる。,1,FALSE
137,8629,車内から出ないため、ガソリンスタンドでもタバコを吸った。,1,FALSE
138,7811,おいしそうな柿が木になっていたので勝手にとって持って帰った。,1,FALSE
139,13601,日本酒を熱燗にしたものが出来上がったのでおちょこに注いであげた,0,FALSE
140,13097,愛犬をお散歩に連れて行くのに寒いといけないのでお洋服を着せた,0,FALSE
141,3482,入館パスを使いまわしてビルに入った,1,FALSE
142,17787,お弁当屋さんの弁当はおかずの量が少なかったので、低評価を付けた。,0,FALSE
143,16277,無人販売所にて、お金を払う前に商品の確認をする,0,FALSE
144,5283,新幹線での出張と申告したが、実際にはバスを利用して差額は黙ってもらっておいた。,1,FALSE
145,2035,友達から借りたゲームを返さずに、勝手に別の友達に貸してしまった,1,FALSE
146,504,おもちゃのお皿に盛りつける,0,FALSE
147,8232,フードロス削減のため賞味期限近くのパンを販売した,0,FALSE
148,2178,ポップコーンを食べながら、映画館で、好きな映画を静かに見た。,0,FALSE
149,6211,新居に引越しをしてきたので、ゴミ出しルールがわからないから、勝手にたくさんゴミを出した。,1,FALSE
150,1581,夜中にお菓子を食べる,0,FALSE
151,13673,強風で飛ばされそうになっていた子供を見て助けた,0,FALSE
152,15502,喉を傷めている娘に唐辛子を食べさせる,1,FALSE
153,439,彼氏の顎を鈍器で叩く,1,FALSE
154,4795,教科書に落書きをする。,0,FALSE
155,17654,SNSで話題になると「いいね！」の数が増えるので、芸能人の事実か分からないような情報を拡散した。,1,FALSE
156,14967,病気になった友達の、お見舞いに行った,0,FALSE
157,14100,友人に風邪薬を分けてあげたが、使用期限が切れていた。,1,FALSE
158,7889,PC作業で目が疲れたので醤油をさした,1,FALSE
159,11100,親猫とはぐれた子猫においしいコーラを飲ませた,1,FALSE
160,14429,路面が滑りそうだったので子供に気をつけさせた,0,FALSE
161,2517,ムカつくことを言った友達を、仲間外れにした,1,FALSE
162,4473,マラソン大会の給水所で、ペットボトルに入れたアイソトニック飲料を置く,0,FALSE
163,5490,たとえ間違いがあった場合誰かに迷惑をかけるだろうと思い、気をつけて仕事をする。,0,FALSE
164,11710,お葬式で足がしびれたので、踊り出す,1,FALSE
165,17018,友達に頼まれた物を購入し、金額をわざと上乗せして購入代金を請求した,1,FALSE
166,6904,新年会の席で未成年の新入社員にアルコールを飲ませた。,1,FALSE
167,8095,想定スケジュールに対して遅れが生じた場合は、無理矢理間に合わせる,0,FALSE
168,13004,倉庫に精米されていないコメをリヤカーで運んだ,0,FALSE
169,16977,そろそろ雪が降りそうなので冬用タイヤに付け替えた,0,FALSE
170,19393,マスコットを作ることにした,0,FALSE
171,17633,望遠鏡を購入したので、隣の木に止まった鳥を眺めた。,0,FALSE
172,14522,隣人が丹精込めて育てている菊の花をこっそり切り取った。,1,FALSE
173,5072,ファミレスで頼んだものと違うものが来たので、店長を呼んで理由を聞いた。,0,FALSE
174,2784,銭湯の脱衣所で、服を脱いだ。,0,FALSE
175,2215,オリンピックの競技場で乱入者を見つける。,0,FALSE
176,17204,下りエスカレーターを登る。,1,FALSE
177,11812,温かいお風呂に入りたいとおばあちゃんが言うので湯船に冷水を張った,1,FALSE
178,13413,人気ラーメン店の行列の後に並んだ,0,FALSE
179,10780,人のためになることを率先して行う,0,FALSE
180,17166,飛行機の座席に大きなスーツケースを持ち込む。,1,FALSE
181,2741,野球で投手になったので、打者のお腹めがけて投球した。,1,FALSE
182,2755,彼女のアロマディフューザーに、唾液を垂らしておいた。,1,FALSE
183,9086,数学で使っていたコンパスの針を、ノートに押し当てた,0,FALSE
184,1912,デパートの試着室でズボンを試着してサイズが合わずにズボンを破いてしまったので、そのズボンを購入した,0,FALSE
185,12375,ピアノでクラシック音楽を演奏する。,0,FALSE
186,8693,クラスで無視されている同級生を他の子と同じように無視した,1,FALSE
187,5848,忘年会に参加し酒を飲み過ぎて大笑いする,0,FALSE
188,12210,紙コップにジュースを注ぐ。,0,FALSE
189,4073,労働基準法で定められた時間を超えて働かせた,1,FALSE
190,1816,責任感を持つ,0,FALSE
191,3579,宴会で裸踊りをする,1,FALSE
192,13607,今夜はお鍋だと言っていたので高級食材を用意した,0,FALSE
193,879,車の運転中に急いでいたので赤信号を止まらずに走行した,1,FALSE
194,9199,毒を持っている虫を、父の靴下に入れた,1,FALSE
195,2960,履歴書を急いで提出したかったので、近くにあった黒いゲルインクボールペンで書く,0,FALSE
196,19817,ありえないくらいの埃を拭いとる,0,FALSE
197,12327,溶けそうなアイスを急いで冷蔵庫に入れた。,1,FALSE
198,5117,お店で食べたスープが美味しかったので、お皿までなめた。,1,FALSE
199,19362,お腹が空いているという事だったので、本屋さんに連れて行った,1,FALSE
200,1088,公衆トイレを汚してしまったので掃除して出てきた,0,FALSE
201,3704,おにぎりの具に鮭を入れた,0,FALSE
202,14799,無人レジで商品を全てスキャンして購入してから鞄に入れた,0,FALSE
203,1511,猿に似た顔の人に、猿に似ていますねと話しかけた,1,FALSE
204,15451,お客としてお金を払っていても店員に対しては礼儀正しくする。,0,FALSE
205,6386,子供が部活でレギュラーでは無かったが、チームの試合を応援しに行った。,0,FALSE
206,11987,重機を使用できる人がいなかったので無免許で使用した,1,FALSE
207,929,芸能人を見かけたので無断で写真を撮影した,1,FALSE
208,6926,朝起きるのが面倒で、学校に遅刻してしまう。,0,TRUE
209,2546,忙しくてペットを可愛がるのを忘れていた,1,TRUE
210,8248,ピアノ発表会で出演者にエリーゼのためにを弾かせた,0,FALSE
211,8863,警官に声をかけられたので慌てて逃げた,1,FALSE
212,17460,大相撲で大番狂わせの取り組みになり、土俵に観客が乱入した。,1,FALSE
213,1457,賞味期限を過ぎていたが、わからないだろうと思って食材として使い、お客さんに提供した,1,FALSE
214,5548,近くで電車を見たいので、線路脇のフェンス越しに待機する,0,FALSE
215,4326,動画撮影のため、無断で小鳥を捕った,1,FALSE
216,6921,部屋のゴミ箱にポテトチップスの空き袋を捨てた。,0,FALSE
217,12532,運動会でリレーを走る息子に下駄を買ってあげた,1,FALSE
218,15354,キャンプ場で、テントに火をつけた。,1,FALSE
219,15392,禁煙場所でタバコを吸った,1,FALSE
220,18191,冬に温泉に入ろうと友達を誘った,0,FALSE
221,5183,上司として部下の残業を強要した。,1,FALSE
222,4421,校庭でバレーボールをする,0,FALSE
223,5378,Youtubeの再生回数を伸ばすために会議を行った。,0,FALSE
224,8311,昆虫園でカブトムシがいたので家に持って帰った,1,FALSE
225,2535,がんが見つかった患者に、いきなり余命を伝える,1,FALSE
226,17330,街頭の選挙ポスターに落書きをする,1,FALSE
227,17007,綺麗に咲いているコスモスがあったので、毎日眺めた,0,FALSE
228,4601,遮断機が上がっているので踏切を渡る。,0,FALSE
229,12273,おにぎりに紙を巻いて食べる。,1,FALSE
230,11079,注文されたコーヒーに砂糖とミルクを付けてお出しした,0,FALSE
231,3143,お気に入りのバッグが壊れたので、欲しがっていた親友にそのまま譲る,1,FALSE
232,2196,神社に供えているお供え物を見つける。,0,FALSE
233,15927,喉が渇いた人に水を飲ませる,0,FALSE
234,14775,相談に対して親身に回答する,0,FALSE
235,7667,傷つけることをわかっていながら人を傷つけることをする。,1,FALSE
236,17624,温泉に入るときはタオルも湯船に入れる,1,FALSE
237,2886,同僚のお弁当の卵焼きがふっくらしておいしそうだったので、「１つどうぞ」と言われたので頂いて食べる,0,FALSE
238,696,家にあったプリンを勝手に食べた,1,FALSE
239,8324,学食で自分の食べた後の食器を片付けて帰った,0,FALSE
240,3231,他人のパンを焼く,1,TRUE
241,16666,遠足に行く娘の水筒の中に水を入れてあげた,0,FALSE
242,7754,公衆のお風呂でお風呂の中にタオルがつからないようにする。,0,FALSE
243,5922,オリンピックの金メダル欲しさにライバルに真似て同じスポーツドリンクを飲む,0,FALSE
244,12713,母の誕生日プレゼントに空っぽの箱を渡した,1,FALSE
245,4308,パスタが出来たので、粉せっけんを振りかけた,1,FALSE
246,19487,子供にお年玉として商品券をあげた,0,FALSE
247,14132,父のワイシャツを、工作用ボンドを使って洗濯した。,1,FALSE
248,16961,お客さんのためにお風呂に入浴剤を入れておく。,0,FALSE
249,6814,職場に新しく配属されたアルバイトの女性に仕事のやり方をまったく教えずに業務を開始させた。,1,FALSE
250,11099,アンパンの中身に小豆を入れた,0,FALSE
251,19658,内服薬について副作用のリスクを説明することなく、患者さんに処方箋を出した。,1,FALSE
252,2622,彼女に未練があるので、結婚式は欠席する,0,FALSE
253,323,子供のころの拳銃遊びは、玉は拾った実弾だった,1,FALSE
254,2550,家族の中に猫アレルギーがいるけれど、どうしても飼いたいと懇願する,1,FALSE
255,17254,個人情報が見えるようにしてから捨てる,1,FALSE
256,17803,担任の先生に出会ったので、挨拶をした。,0,FALSE
257,15859,加湿器の容器の水にアロマオイルをまぜた,0,FALSE
258,13664,ドアを開けようとしたら指を挟んでしまい指がちぎれた,0,FALSE
259,12888,不思議にそれを見ていた,0,TRUE
260,9348,転んでホームの下に落ちそうな人を、受け止めた。,0,FALSE
261,12802,一生懸命働いていた,0,FALSE
262,13443,彼女のクリスマスプレゼントに高級ブティックのバックをプレゼントした,0,FALSE
263,4741,子供がうるさかったので、おもちゃを出した。,0,FALSE
264,11977,買い物に出掛けるのに赤ちゃんを一人で家に置いて出掛けた,1,FALSE
265,6849,空港のターミナルで家族の到着を待っていたことをセキュリティに咎められたので、警察を呼べ、と言った。,1,FALSE
266,5733,白熱した会議で、口うるさい相手を爆破した,1,FALSE
267,5906,降車駅に着いたので読みかけの雑誌を車内に放置する,1,FALSE
268,3336,臭うまえにゴミを出す,0,FALSE
269,17687,失恋した女は思い悩み、部屋に照明をつけた。,0,FALSE
270,12496,回転寿司で食べ終わったお皿をレーンに置いた,1,FALSE
271,485,妻に新しく好きな人ができたと言われる,1,FALSE
272,1867,歌を歌うのが苦手な友達に、大勢の前で歌を歌わせた,1,FALSE
273,7669,嫌いな物をおしつける。,1,FALSE
274,9812,友人と話していたが、急いで帰らなければならなかったため、友人の腰を折った。,0,TRUE
275,6726,目の不自由な人が買い物に来たので、賞味期限切れの商品を買わせた。,1,FALSE
276,18001,取引先との約束の時間の10分前に会議室に着く。,0,FALSE
277,14003,今日も蕎麦打ちを見るために、来店をする。,0,FALSE
278,14905,美術館で素敵な絵画を観た。,0,FALSE
279,857,目の前を歩いていた人のリュックが開いていたのでゴミを入れた,1,FALSE
280,12222,お昼ごはんとして、おにぎりをラップに包んで用意した。,0,FALSE
281,5554,美味しいお酒を飲み、車の助手席に座って帰る,0,FALSE
282,16950,自分が犯した罪の責任をどうごまかすかを考えた,1,FALSE
283,448,作ってもらったパンケーキを食べる,0,FALSE
284,5747,全裸で教室に入る,1,FALSE
285,12555,お昼ご飯を食べた後職場の洗面所で歯を磨いた,0,FALSE
286,16314,ジュース用の硝子のコップを割ったので、代わりに陶器のカップを用意する,0,FALSE
287,11518,目覚まし時計が鳴り響くので、時計を壊して消す,1,FALSE
288,16928,見たい映画があると言って知り合いとリビングのテレビで映画を見た,0,FALSE
289,10287,環境に配慮した結果、ラーメン屋で割りばしを使うことを止めた,0,FALSE
290,14145,友人の家に行くのに一方通行の道を少し通ると近いのだが、遠回りして行った。,0,FALSE
291,3129,PTAの役員が決まらないので、気分次第で役員会を欠席することがあるが、議事録は読みますと、あらかじめ断って引き受ける,1,FALSE
292,7475,体育会系の学生にだけ、ライスを大盛にした。,0,FALSE
293,10727,カードを売るために買う,0,TRUE
